export const BOOKMARKS = [
  {
    index: 2,
    title: "adobe after",
    url: "https://dl.imontou.ch/Adobe.Creative.Cloud.Collection.CC.2020.(x64)/Adobe%20After%20Effects%20CC%202020%20v17.0.0.557%20x64.iso",
    id: 375,
    parentId: "1",
    dateAddedLocal: "21/11/2020, 17:59:18",
    dateAddedUTC: "2020-11-21T12:29:18.349Z",
  },
  {
    index: 3,
    title: "serverless blog",
    id: 9,
    parentId: "1",
    dateAddedLocal: "03/11/2020, 11:49:57",
    dateAddedUTC: "2020-11-03T06:19:57.276Z",
  },
  {
    index: 0,
    title: "What is Serverless",
    url: "https://www.notion.so/achuth/What-is-Serverless-7d5aed277bfe4a029da1f740f5bf2863",
    id: 10,
    parentId: "9",
    dateAddedLocal: "02/07/2020, 21:21:28",
    dateAddedUTC: "2020-07-02T15:51:28.448Z",
  },
  {
    index: 1,
    title: "Build a To-Do List JAMstack Application | Cloudflare Workers",
    url: "https://developers.cloudflare.com/workers/tutorials/build-a-jamstack-app",
    id: 11,
    parentId: "9",
    dateAddedLocal: "02/07/2020, 21:21:28",
    dateAddedUTC: "2020-07-02T15:51:28.466Z",
  },
  {
    index: 2,
    title: "Glitch",
    url: "https://glitch.com/",
    id: 12,
    parentId: "9",
    dateAddedLocal: "02/07/2020, 21:21:28",
    dateAddedUTC: "2020-07-02T15:51:28.466Z",
  },
  {
    index: 3,
    title: "Slack | notify | ccode",
    url: "https://app.slack.com/client/T97E94ESJ/DDXTEFM9N",
    id: 13,
    parentId: "9",
    dateAddedLocal: "02/07/2020, 21:21:28",
    dateAddedUTC: "2020-07-02T15:51:28.466Z",
  },
  {
    index: 4,
    title: "Slack API: Applications | ccode Slack",
    url: "https://api.slack.com/apps/ADY10QCFK",
    id: 14,
    parentId: "9",
    dateAddedLocal: "02/07/2020, 21:21:28",
    dateAddedUTC: "2020-07-02T15:51:28.466Z",
  },
  {
    index: 4,
    title: "electron",
    id: 15,
    parentId: "1",
    dateAddedLocal: "03/11/2020, 11:49:57",
    dateAddedUTC: "2020-11-03T06:19:57.277Z",
  },
  {
    index: 0,
    title: "apps",
    id: 16,
    parentId: "15",
    dateAddedLocal: "03/11/2020, 11:49:57",
    dateAddedUTC: "2020-11-03T06:19:57.277Z",
  },
  {
    index: 0,
    title: "screenshot app",
    id: 17,
    parentId: "16",
    dateAddedLocal: "03/11/2020, 11:49:57",
    dateAddedUTC: "2020-11-03T06:19:57.277Z",
  },
  {
    index: 0,
    title:
      "Building a Snipping Tool with Electron, React and Node.js â€“ Quantizd",
    url: "https://quantizd.com/building-a-snipping-tool-with-electron-react-and-node-js/",
    id: 18,
    parentId: "17",
    dateAddedLocal: "11/08/2018, 13:02:02",
    dateAddedUTC: "2018-08-11T07:32:02.913Z",
  },
  {
    index: 1,
    title:
      "https://macarthur.me/posts/building-a-lambda-function-with-netlify/",
    url: "https://macarthur.me/posts/building-a-lambda-function-with-netlify/",
    id: 19,
    parentId: "17",
    dateAddedLocal: "12/08/2018, 10:17:26",
    dateAddedUTC: "2018-08-12T04:47:26.312Z",
  },
  {
    index: 2,
    title: "theâ€ˆsecretâ€ˆbehindâ€ˆgreatâ€ˆcopywriting",
    url: "https://www.felixjamestin.com/post/the-secret-to-great-copywriting",
    id: 20,
    parentId: "17",
    dateAddedLocal: "16/08/2018, 20:39:20",
    dateAddedUTC: "2018-08-16T15:09:20.311Z",
  },
  {
    index: 3,
    title: "Build Stages: Deploying to GitHub Releases - Travis CI",
    url: "https://docs.travis-ci.com/user/build-stages/deploy-github-releases/",
    id: 21,
    parentId: "17",
    dateAddedLocal: "12/07/2018, 01:03:00",
    dateAddedUTC: "2018-07-11T19:33:00.080Z",
  },
  {
    index: 4,
    title: "@expo/vector-icons directory",
    url: "https://expo.github.io/vector-icons/",
    id: 22,
    parentId: "17",
    dateAddedLocal: "17/02/2018, 12:35:12",
    dateAddedUTC: "2018-02-17T07:05:12.727Z",
  },
  {
    index: 1,
    title: "electron icons",
    url: "https://findicons.com/convert",
    id: 23,
    parentId: "15",
    dateAddedLocal: "06/01/2019, 20:17:28",
    dateAddedUTC: "2019-01-06T14:47:28.540Z",
  },
  {
    index: 2,
    title: "Teampaper â€” deliver designs faster",
    url: "https://heartbeat.ua/projects/teampaper",
    id: 24,
    parentId: "15",
    dateAddedLocal: "06/01/2019, 20:50:33",
    dateAddedUTC: "2019-01-06T15:20:33.014Z",
  },
  {
    index: 3,
    title: "DMG installer for electron app | Christian Engvall",
    url: "https://www.christianengvall.se/dmg-installer-electron-app/",
    id: 25,
    parentId: "15",
    dateAddedLocal: "10/01/2019, 00:30:31",
    dateAddedUTC: "2019-01-09T19:00:31.955Z",
  },
  {
    index: 4,
    title: "envelop",
    id: 26,
    parentId: "15",
    dateAddedLocal: "03/11/2020, 11:49:57",
    dateAddedUTC: "2020-11-03T06:19:57.278Z",
  },
  {
    index: 0,
    title: "achuthhadnoor/stack - master",
    url: "https://db056710-081c-4348-8007-64d5728becbc.ws-ap01.gitpod.io/#/workspace/stack",
    id: 27,
    parentId: "26",
    dateAddedLocal: "05/01/2020, 10:59:44",
    dateAddedUTC: "2020-01-05T05:29:44.109Z",
  },
  {
    index: 1,
    title: "(1) React Js tutorial - upload file example - YouTube",
    url: "https://www.youtube.com/watch?v=sp9r6hSWH_o",
    id: 28,
    parentId: "26",
    dateAddedLocal: "05/01/2020, 10:59:44",
    dateAddedUTC: "2020-01-05T05:29:44.110Z",
  },
  {
    index: 2,
    title: "Visual identity and UI/UX for Adversus â€” web-based dialer and CRM",
    url: "https://heartbeat.ua/projects/adversus",
    id: 29,
    parentId: "26",
    dateAddedLocal: "05/01/2020, 10:59:44",
    dateAddedUTC: "2020-01-05T05:29:44.110Z",
  },
  {
    index: 3,
    title: "GetFileOptions | blockstack.js 19.4.0-beta.1 Library Reference",
    url: "https://blockstack.github.io/blockstack.js/interfaces/getfileoptions.html",
    id: 30,
    parentId: "26",
    dateAddedLocal: "05/01/2020, 10:59:44",
    dateAddedUTC: "2020-01-05T05:29:44.110Z",
  },
  {
    index: 4,
    title:
      "envelop-web/with_file.js at b9fec09dec4a054463cd089aa487b5763559c0b3 Â· envelop-app/envelop-web",
    url: "https://github.com/envelop-app/envelop-web/blob/b9fec09dec4a054463cd089aa487b5763559c0b3/assets/javascripts/lib/records/mixins/with_file.js",
    id: 31,
    parentId: "26",
    dateAddedLocal: "05/01/2020, 10:59:44",
    dateAddedUTC: "2020-01-05T05:29:44.110Z",
  },
  {
    index: 5,
    title: "splitwise clone",
    url: "https://www.notion.so/voffice/splitwise-clone-472ed2cef3af4065830ca953bf3d65f6",
    id: 32,
    parentId: "26",
    dateAddedLocal: "05/01/2020, 10:59:44",
    dateAddedUTC: "2020-01-05T05:29:44.111Z",
  },
  {
    index: 6,
    title: "Walling - A Better Way to Organize Ideas",
    url: "https://walling.app/",
    id: 33,
    parentId: "26",
    dateAddedLocal: "24/01/2020, 23:15:57",
    dateAddedUTC: "2020-01-24T17:45:57.906Z",
  },
  {
    index: 5,
    title: "Done. Minimalist To-do app for macOS",
    url: "https://done.mozestudio.com/",
    id: 34,
    parentId: "15",
    dateAddedLocal: "01/04/2020, 13:40:00",
    dateAddedUTC: "2020-04-01T08:10:00.447Z",
  },
  {
    index: 6,
    title: "achuth.blog",
    url: "https://airtable.com/shrVMDV3ig0hTu4xM",
    id: 35,
    parentId: "15",
    dateAddedLocal: "02/04/2020, 17:43:10",
    dateAddedUTC: "2020-04-02T12:13:10.999Z",
  },
  {
    index: 5,
    title: "expence",
    id: 36,
    parentId: "1",
    dateAddedLocal: "03/11/2020, 11:49:57",
    dateAddedUTC: "2020-11-03T06:19:57.279Z",
  },
  {
    index: 0,
    title: "presentation_-_p1.png (1440Ã—9567)",
    url: "https://cdn.dribbble.com/users/1418924/screenshots/6381174/attachments/1366365/presentation_-_p1.png",
    id: 37,
    parentId: "36",
    dateAddedLocal: "20/07/2019, 17:25:21",
    dateAddedUTC: "2019-07-20T11:55:21.201Z",
  },
  {
    index: 1,
    title: "presentation_-_p2.png (1440Ã—12648)",
    url: "https://cdn.dribbble.com/users/1418924/screenshots/6381174/attachments/1366370/presentation_-_p2.png",
    id: 38,
    parentId: "36",
    dateAddedLocal: "20/07/2019, 17:25:09",
    dateAddedUTC: "2019-07-20T11:55:09.233Z",
  },
  {
    index: 2,
    title: "expence",
    url: "https://cdn.dribbble.com/users/1418924/screenshots/6381174/attachments/1366371/presentation_-_p3.png",
    id: 39,
    parentId: "36",
    dateAddedLocal: "20/07/2019, 17:24:57",
    dateAddedUTC: "2019-07-20T11:54:57.522Z",
  },
  {
    index: 6,
    title: "expencer",
    id: 40,
    parentId: "1",
    dateAddedLocal: "03/11/2020, 11:49:57",
    dateAddedUTC: "2020-11-03T06:19:57.279Z",
  },
  {
    index: 0,
    title: "circlebars-plugin-demo",
    url: "https://codepen.io/itaditya/pen/QKExjL",
    id: 41,
    parentId: "40",
    dateAddedLocal: "22/12/2017, 16:49:19",
    dateAddedUTC: "2017-12-22T11:19:19.309Z",
  },
  {
    index: 1,
    title: "vuepouch/README.md at master Â· sadick254/vuepouch",
    url: "https://github.com/sadick254/vuepouch/blob/master/README.md",
    id: 42,
    parentId: "40",
    dateAddedLocal: "23/12/2017, 19:03:08",
    dateAddedUTC: "2017-12-23T13:33:08.451Z",
  },
  {
    index: 2,
    title:
      "vrajroham/vue-circle-progress: A Vue.js component to draw animated circular progress bars",
    url: "https://github.com/vrajroham/vue-circle-progress",
    id: 43,
    parentId: "40",
    dateAddedLocal: "24/12/2017, 16:16:55",
    dateAddedUTC: "2017-12-24T10:46:55.277Z",
  },
  {
    index: 3,
    title:
      "GeoffZhu/vue-event-calendar: A simple events calendar for Vue2, no dependencies except Vue2.",
    url: "https://github.com/GeoffZhu/vue-event-calendar",
    id: 44,
    parentId: "40",
    dateAddedLocal: "02/01/2018, 11:14:55",
    dateAddedUTC: "2018-01-02T05:44:55.080Z",
  },
  {
    index: 7,
    title: "concepts",
    id: 45,
    parentId: "1",
    dateAddedLocal: "03/11/2020, 11:49:57",
    dateAddedUTC: "2020-11-03T06:19:57.280Z",
  },
  {
    index: 0,
    title: "4b517644389359.58113d346c04a.jpg (1400Ã—9721)",
    url: "https://mir-s3-cdn-cf.behance.net/project_modules/1400/4b517644389359.58113d346c04a.jpg",
    id: 46,
    parentId: "45",
    dateAddedLocal: "06/04/2017, 14:55:26",
    dateAddedUTC: "2017-04-06T09:25:26.694Z",
  },
  {
    index: 1,
    title: "b723a836177587.5712244285ea6.jpg (1400Ã—4625)",
    url: "https://mir-s3-cdn-cf.behance.net/project_modules/1400/b723a836177587.5712244285ea6.jpg",
    id: 47,
    parentId: "45",
    dateAddedLocal: "06/04/2017, 14:55:40",
    dateAddedUTC: "2017-04-06T09:25:40.704Z",
  },
  {
    index: 2,
    title: "56bfcf33166863.56a5d574ce591.jpg (1400Ã—1580)",
    url: "https://mir-s3-cdn-cf.behance.net/project_modules/1400/56bfcf33166863.56a5d574ce591.jpg",
    id: 48,
    parentId: "45",
    dateAddedLocal: "06/04/2017, 14:55:48",
    dateAddedUTC: "2017-04-06T09:25:48.549Z",
  },
  {
    index: 3,
    title: "6da14b33166863.56a5d9a41f747.jpg (1400Ã—2132)",
    url: "https://mir-s3-cdn-cf.behance.net/project_modules/1400/6da14b33166863.56a5d9a41f747.jpg",
    id: 49,
    parentId: "45",
    dateAddedLocal: "06/04/2017, 14:55:52",
    dateAddedUTC: "2017-04-06T09:25:52.266Z",
  },
  {
    index: 4,
    title: "We Craft Apps - Web & mobile agency in Nantes",
    url: "https://www.wecraftapps.com/expertises",
    id: 50,
    parentId: "45",
    dateAddedLocal: "11/04/2017, 19:04:21",
    dateAddedUTC: "2017-04-11T13:34:21.401Z",
  },
  {
    index: 5,
    title: "b7c8f244389359.58113d34afdec.jpg (1400Ã—2503)",
    url: "https://mir-s3-cdn-cf.behance.net/project_modules/fs/b7c8f244389359.58113d34afdec.jpg",
    id: 51,
    parentId: "45",
    dateAddedLocal: "16/04/2017, 15:55:15",
    dateAddedUTC: "2017-04-16T10:25:15.127Z",
  },
  {
    index: 6,
    title: "0c8b3444389359.58131a8dbc7e7.gif (1400Ã—981)",
    url: "https://mir-s3-cdn-cf.behance.net/project_modules/fs/0c8b3444389359.58131a8dbc7e7.gif",
    id: 52,
    parentId: "45",
    dateAddedLocal: "16/04/2017, 15:55:20",
    dateAddedUTC: "2017-04-16T10:25:20.383Z",
  },
  {
    index: 7,
    title: "SW Toolbox",
    url: "https://googlechrome.github.io/sw-toolbox/",
    id: 53,
    parentId: "45",
    dateAddedLocal: "16/04/2017, 16:13:22",
    dateAddedUTC: "2017-04-16T10:43:22.699Z",
  },
  {
    index: 8,
    title: "wireframing_cookingapp.png (800Ã—600)",
    url: "https://cdn.dribbble.com/users/77111/screenshots/2676458/wireframing_cookingapp.png",
    id: 54,
    parentId: "45",
    dateAddedLocal: "16/05/2017, 15:47:31",
    dateAddedUTC: "2017-05-16T10:17:31.864Z",
  },
  {
    index: 9,
    title: "404.png (800Ã—600)",
    url: "https://cdn.dribbble.com/users/239075/screenshots/2586577/404.png",
    id: 55,
    parentId: "45",
    dateAddedLocal: "02/06/2017, 17:06:19",
    dateAddedUTC: "2017-06-02T11:36:19.376Z",
  },
  {
    index: 10,
    title: "iphone_white_copy_7.png (800Ã—600)",
    url: "https://cdn.dribbble.com/users/1182410/screenshots/3539055/iphone_white_copy_7.png",
    id: 56,
    parentId: "45",
    dateAddedLocal: "02/06/2017, 17:06:35",
    dateAddedUTC: "2017-06-02T11:36:35.036Z",
  },
  {
    index: 11,
    title: "task-manager.png (800Ã—600)",
    url: "https://cdn.dribbble.com/users/389116/screenshots/3303095/task-manager.png",
    id: 57,
    parentId: "45",
    dateAddedLocal: "02/06/2017, 19:10:52",
    dateAddedUTC: "2017-06-02T13:40:52.903Z",
  },
  {
    index: 12,
    title: "intercom",
    id: 58,
    parentId: "45",
    dateAddedLocal: "03/11/2020, 11:49:57",
    dateAddedUTC: "2020-11-03T06:19:57.281Z",
  },
  {
    index: 0,
    title:
      "WIt-m1ua89lc7hjFY2r1zSulUdxGZqzdL_jZ2U4GQLA3e0B2qSb1C57Fv00CINBx=h900-rw (534Ã—900)",
    url: "https://lh3.googleusercontent.com/WIt-m1ua89lc7hjFY2r1zSulUdxGZqzdL_jZ2U4GQLA3e0B2qSb1C57Fv00CINBx=h900-rw",
    id: 59,
    parentId: "58",
    dateAddedLocal: "22/01/2017, 17:39:01",
    dateAddedUTC: "2017-01-22T12:09:01.079Z",
  },
  {
    index: 1,
    title:
      "cLrVnJnNXGqdVQ0ngkrGeg0Iacyjt30raA19iV6Ar8K-20bPfSKu2HPOFt2t2CY-yw=h900-rw (534Ã—900)",
    url: "https://lh3.googleusercontent.com/cLrVnJnNXGqdVQ0ngkrGeg0Iacyjt30raA19iV6Ar8K-20bPfSKu2HPOFt2t2CY-yw=h900-rw",
    id: 60,
    parentId: "58",
    dateAddedLocal: "22/01/2017, 17:39:20",
    dateAddedUTC: "2017-01-22T12:09:20.115Z",
  },
  {
    index: 2,
    title:
      "K2dcnOtEEEh0n1T6GsmN7tm_D3wmBeDsRqcwAZhmePiVovV8kf00hAI14bZDrmoKuL4=h900-rw (534Ã—900)",
    url: "https://lh3.googleusercontent.com/K2dcnOtEEEh0n1T6GsmN7tm_D3wmBeDsRqcwAZhmePiVovV8kf00hAI14bZDrmoKuL4=h900-rw",
    id: 61,
    parentId: "58",
    dateAddedLocal: "22/01/2017, 17:39:23",
    dateAddedUTC: "2017-01-22T12:09:23.090Z",
  },
  {
    index: 3,
    title:
      "F5PBS9q_USxtrzVSiXhzw63GGNxQIvpZechAUlIATRZkQKfCNIkoZDAKv0w5j2weEcs=h900-rw (534Ã—900)",
    url: "https://lh3.googleusercontent.com/F5PBS9q_USxtrzVSiXhzw63GGNxQIvpZechAUlIATRZkQKfCNIkoZDAKv0w5j2weEcs=h900-rw",
    id: 62,
    parentId: "58",
    dateAddedLocal: "22/01/2017, 17:39:25",
    dateAddedUTC: "2017-01-22T12:09:25.751Z",
  },
  {
    index: 4,
    title:
      "3G-PdCQLWAc-cb6lKHk3thYIMDe7Mh2K72Ki8CJlibYRjwUXya9VQsOeVzMDdCe21g=h900-rw (534Ã—900)",
    url: "https://lh3.googleusercontent.com/3G-PdCQLWAc-cb6lKHk3thYIMDe7Mh2K72Ki8CJlibYRjwUXya9VQsOeVzMDdCe21g=h900-rw",
    id: 63,
    parentId: "58",
    dateAddedLocal: "22/01/2017, 17:39:31",
    dateAddedUTC: "2017-01-22T12:09:31.909Z",
  },
  {
    index: 5,
    title:
      "KIZvM3Xlj4CF4rXOoirNi26O3rhjVN_B_16NAUUJOmuq-uYnww5pRGi_o3roX9homA=h900-rw (534Ã—900)",
    url: "https://lh3.googleusercontent.com/KIZvM3Xlj4CF4rXOoirNi26O3rhjVN_B_16NAUUJOmuq-uYnww5pRGi_o3roX9homA=h900-rw",
    id: 64,
    parentId: "58",
    dateAddedLocal: "22/01/2017, 17:39:34",
    dateAddedUTC: "2017-01-22T12:09:34.727Z",
  },
  {
    index: 6,
    title: "intercom-inbox2-2x.jpg (1920Ã—840)",
    url: "http://emmetconnolly.com/images/intercom-inbox2-2x.jpg",
    id: 65,
    parentId: "58",
    dateAddedLocal: "20/03/2017, 19:00:14",
    dateAddedUTC: "2017-03-20T13:30:14.924Z",
  },
  {
    index: 8,
    title: "mapbox",
    id: 66,
    parentId: "1",
    dateAddedLocal: "03/11/2020, 11:49:57",
    dateAddedUTC: "2020-11-03T06:19:57.282Z",
  },
  {
    index: 0,
    title: "Mapbox API Documentation",
    url: "https://www.mapbox.com/api-documentation/?language=JavaScript#reading-this-documentation",
    id: 67,
    parentId: "66",
    dateAddedLocal: "13/10/2016, 12:36:03",
    dateAddedUTC: "2016-10-13T07:06:03.062Z",
  },
  {
    index: 1,
    title:
      "mapbox/mapbox-sdk-js: A node.js and browser JavaScript client to Mapbox services",
    url: "https://github.com/mapbox/mapbox-sdk-js",
    id: 68,
    parentId: "66",
    dateAddedLocal: "13/10/2016, 12:36:03",
    dateAddedUTC: "2016-10-13T07:06:03.063Z",
  },
  {
    index: 9,
    title: "react expencer",
    id: 69,
    parentId: "1",
    dateAddedLocal: "03/11/2020, 11:49:57",
    dateAddedUTC: "2020-11-03T06:19:57.282Z",
  },
  {
    index: 0,
    title:
      "meteor-factory/react-native-tinder-swipe-cards: Tinder-like swipe cards for your React Native app",
    url: "https://github.com/meteor-factory/react-native-tinder-swipe-cards",
    id: 70,
    parentId: "69",
    dateAddedLocal: "08/01/2018, 15:57:02",
    dateAddedUTC: "2018-01-08T10:27:02.283Z",
  },
  {
    index: 1,
    title:
      "Offline First Apps with React Native and Redux | Rational App Development",
    url: "https://rationalappdev.com/offline-first-apps-with-react-native-and-redux/",
    id: 71,
    parentId: "69",
    dateAddedLocal: "09/01/2018, 08:30:00",
    dateAddedUTC: "2018-01-09T03:00:00.422Z",
  },
  {
    index: 2,
    title:
      "Osedea/react-native-offline-first-example: Example App using best practices for React Native offline (InstaMeow) presented at React Native EU 2017",
    url: "https://github.com/Osedea/react-native-offline-first-example",
    id: 72,
    parentId: "69",
    dateAddedLocal: "09/01/2018, 08:32:25",
    dateAddedUTC: "2018-01-09T03:02:25.680Z",
  },
  {
    index: 3,
    title: "Notifications in expo",
    url: "https://docs.expo.io/versions/latest/sdk/notifications.html",
    id: 73,
    parentId: "69",
    dateAddedLocal: "09/01/2018, 12:37:29",
    dateAddedUTC: "2018-01-09T07:07:29.247Z",
  },
  {
    index: 4,
    title: "react-native-swipe-cards",
    url: "https://www.npmjs.com/package/react-native-swipe-cards#product-navigation",
    id: 74,
    parentId: "69",
    dateAddedLocal: "12/01/2018, 09:25:29",
    dateAddedUTC: "2018-01-12T03:55:29.617Z",
  },
  {
    index: 5,
    title:
      "react-native-circular-progress/README.md at master Â· bgryszko/react-native-circular-progress",
    url: "https://github.com/bgryszko/react-native-circular-progress/blob/master/README.md",
    id: 75,
    parentId: "69",
    dateAddedLocal: "12/01/2018, 10:18:18",
    dateAddedUTC: "2018-01-12T04:48:18.318Z",
  },
  {
    index: 6,
    title: "React Native: Nine Animation Screencast Tutorials â€“ codeburst",
    url: "https://codeburst.io/react-native-nine-animation-screencast-tutorials-9d031e8bb86f",
    id: 76,
    parentId: "69",
    dateAddedLocal: "24/01/2018, 17:11:29",
    dateAddedUTC: "2018-01-24T11:41:29.698Z",
  },
  {
    index: 7,
    title: "useHooks - Easy to understand React Hook recipes",
    url: "https://usehooks.com/",
    id: 77,
    parentId: "69",
    dateAddedLocal: "04/05/2019, 10:09:49",
    dateAddedUTC: "2019-05-04T04:39:49.808Z",
  },
  {
    index: 8,
    title: "Building Design Systems With React",
    url: "https://slides.com/emmawedekind/building-design-systems-with-react#/36",
    id: 78,
    parentId: "69",
    dateAddedLocal: "07/05/2019, 08:08:07",
    dateAddedUTC: "2019-05-07T02:38:07.599Z",
  },
  {
    index: 9,
    title:
      "So whatâ€™s this GraphQL thing I keep hearing about? â€“ freeCodeCamp.org",
    url: "https://medium.freecodecamp.org/so-whats-this-graphql-thing-i-keep-hearing-about-baf4d36c20cf",
    id: 79,
    parentId: "69",
    dateAddedLocal: "14/05/2019, 17:24:34",
    dateAddedUTC: "2019-05-14T11:54:34.654Z",
  },
  {
    index: 10,
    title: "face.io",
    id: 80,
    parentId: "1",
    dateAddedLocal: "03/11/2020, 11:49:57",
    dateAddedUTC: "2020-11-03T06:19:57.283Z",
  },
  {
    index: 0,
    title: "getUserMedia() -> ImageCapture demo",
    url: "https://rawgit.com/Miguelao/demos/master/imagecapture.html",
    id: 81,
    parentId: "80",
    dateAddedLocal: "15/11/2016, 15:28:03",
    dateAddedUTC: "2016-11-15T09:58:03.520Z",
  },
  {
    index: 1,
    title: "Face Detection in Images Demo w/ overlay on canvas",
    url: "http://codepen.io/miguelao/pen/ORYbbm",
    id: 82,
    parentId: "80",
    dateAddedLocal: "15/11/2016, 15:27:56",
    dateAddedUTC: "2016-11-15T09:57:56.954Z",
  },
  {
    index: 2,
    title: "canmera",
    url: "https://www.html5rocks.com/en/tutorials/getusermedia/intro/#toc-screenshot",
    id: 83,
    parentId: "80",
    dateAddedLocal: "17/10/2016, 17:48:26",
    dateAddedUTC: "2016-10-17T12:18:26.371Z",
  },
  {
    index: 11,
    title: "quotes.rest/qod.json",
    url: "http://quotes.rest/qod.json",
    id: 84,
    parentId: "1",
    dateAddedLocal: "01/12/2018, 13:23:19",
    dateAddedUTC: "2018-12-01T07:53:19.961Z",
  },
  {
    index: 12,
    title: "IOT/WEB",
    id: 85,
    parentId: "1",
    dateAddedLocal: "03/11/2020, 11:49:57",
    dateAddedUTC: "2020-11-03T06:19:57.284Z",
  },
  {
    index: 0,
    title: "The Physical Web",
    url: "https://google.github.io/physical-web/",
    id: 86,
    parentId: "85",
    dateAddedLocal: "19/10/2016, 19:17:32",
    dateAddedUTC: "2016-10-19T13:47:32.523Z",
  },
  {
    index: 1,
    title: "Programming Guide - Google Docs",
    url: "https://docs.google.com/document/d/1TknJoByY4kMF5wCX0OhFqLPf2am2vyQ-NNdw1GFentk/edit#",
    id: 87,
    parentId: "85",
    dateAddedLocal: "09/12/2017, 14:11:43",
    dateAddedUTC: "2017-12-09T08:41:43.479Z",
  },
  {
    index: 2,
    title: "Programming trivia - Google Sheets",
    url: "https://docs.google.com/spreadsheets/d/1dzGeaglgQoVNHkCHl8_zK1xC43A9FbnAe1u4JuZ4-hM/edit#gid=921336727",
    id: 88,
    parentId: "85",
    dateAddedLocal: "09/12/2017, 12:28:36",
    dateAddedUTC: "2017-12-09T06:58:36.192Z",
  },
  {
    index: 3,
    title:
      ".ember776, #ember776::before { width: 320px; height: 320px; } .ember776::before { padding-top: 100%; } @media (min-width: 736px) { .ember776, #ember776::before { width: 158px; height: 158px; } .ember776::before { padding-top: 100%; } } @media (min-width: ",
    url: "https://itunes.apple.com/in/app/google-authenticator/id388497605?mt=8",
    id: 89,
    parentId: "85",
    dateAddedLocal: "23/11/2018, 23:25:30",
    dateAddedUTC: "2018-11-23T17:55:30.573Z",
  },
  {
    index: 13,
    title: "Marketing",
    id: 90,
    parentId: "1",
    dateAddedLocal: "03/11/2020, 11:49:57",
    dateAddedUTC: "2020-11-03T06:19:57.285Z",
  },
  {
    index: 0,
    title: "Conversio",
    url: "https://conversio.com/",
    id: 91,
    parentId: "90",
    dateAddedLocal: "18/09/2017, 10:58:44",
    dateAddedUTC: "2017-09-18T05:28:44.414Z",
  },
  {
    index: 1,
    title: "Design for Startup",
    url: "http://designforstartup.net/#styleguides",
    id: 92,
    parentId: "90",
    dateAddedLocal: "27/11/2016, 17:48:14",
    dateAddedUTC: "2016-11-27T12:18:14.829Z",
  },
  {
    index: 2,
    title: "SEO: The Free Beginnerâ€™s Guide From Moz",
    url: "http://d2eeipcrcdle6.cloudfront.net/guides/Moz-The-Beginners-Guide-To-SEO.pdf",
    id: 93,
    parentId: "90",
    dateAddedLocal: "16/11/2016, 18:26:16",
    dateAddedUTC: "2016-11-16T12:56:16.530Z",
  },
  {
    index: 14,
    title:
      "eddydn/AndroidCustomKeyboard: Full source code Android Custom Keyboard",
    url: "https://github.com/eddydn/AndroidCustomKeyboard",
    id: 94,
    parentId: "1",
    dateAddedLocal: "25/09/2018, 23:58:39",
    dateAddedUTC: "2018-09-25T18:28:39.425Z",
  },
  {
    index: 15,
    title: "Email client",
    id: 95,
    parentId: "1",
    dateAddedLocal: "03/11/2020, 11:49:57",
    dateAddedUTC: "2020-11-03T06:19:57.286Z",
  },
  {
    index: 0,
    title: "Sending Emails with the Gmail JavaScript API â€” SitePoint",
    url: "https://www.sitepoint.com/sending-emails-gmail-javascript-api/",
    id: 96,
    parentId: "95",
    dateAddedLocal: "07/05/2019, 13:03:44",
    dateAddedUTC: "2019-05-07T07:33:44.365Z",
  },
  {
    index: 1,
    title: "Mastering Your Inbox with the Gmail JavaScript API â€” SitePoint",
    url: "https://www.sitepoint.com/mastering-your-inbox-with-gmail-javascript-api/",
    id: 97,
    parentId: "95",
    dateAddedLocal: "07/05/2019, 13:04:20",
    dateAddedUTC: "2019-05-07T07:34:20.646Z",
  },
  {
    index: 2,
    title:
      "frisbeefish/nimblerx-gmail: This is a ES6, ReactJS, Gmail API web app that lets you read your inbox and compose emails. This is just a toy.",
    url: "https://github.com/frisbeefish/nimblerx-gmail",
    id: 98,
    parentId: "95",
    dateAddedLocal: "15/05/2019, 18:54:59",
    dateAddedUTC: "2019-05-15T13:24:59.371Z",
  },
  {
    index: 3,
    title: "Gmail",
    url: "https://accounts.google.com/signin/v2/sl/pwd?service=mail&passive=true&rm=false&continue=https%3A%2F%2Fmail.google.com%2Fmail%2F&ss=1&scc=1&ltmpl=default&ltmplcache=2&emr=1&osid=1&flowName=GlifWebSignIn&flowEntry=AddSession&cid=0&navigationDirection=forward",
    id: 99,
    parentId: "95",
    dateAddedLocal: "16/05/2019, 19:11:52",
    dateAddedUTC: "2019-05-16T13:41:52.564Z",
  },
  {
    index: 4,
    title:
      "State Management with React Hooks and Context API in 10 lines of code!",
    url: "https://medium.com/simply/state-management-with-react-hooks-and-context-api-at-10-lines-of-code-baf6be8302c",
    id: 100,
    parentId: "95",
    dateAddedLocal: "17/05/2019, 11:54:55",
    dateAddedUTC: "2019-05-17T06:24:55.117Z",
  },
  {
    index: 5,
    title:
      "FlutterExampleApps/readme.md at master Â· iampawan/FlutterExampleApps",
    url: "https://github.com/iampawan/FlutterExampleApps/blob/master/readme.md",
    id: 101,
    parentId: "95",
    dateAddedLocal: "15/06/2019, 21:51:47",
    dateAddedUTC: "2019-06-15T16:21:47.779Z",
  },
  {
    index: 6,
    title: "Tempo - The email client for Mac that helps you focus",
    url: "https://www.yourtempo.co/",
    id: 102,
    parentId: "95",
    dateAddedLocal: "12/09/2019, 12:40:16",
    dateAddedUTC: "2019-09-12T07:10:16.178Z",
  },
  {
    index: 7,
    title: "Implement Tree view component with ReactJS and Styled-Components",
    url: "https://medium.com/@davidtranwd/implement-tree-view-component-with-reactjs-and-styled-components-5eea3b1603cf",
    id: 103,
    parentId: "95",
    dateAddedLocal: "02/04/2020, 18:21:03",
    dateAddedUTC: "2020-04-02T12:51:03.549Z",
  },
  {
    index: 16,
    title: "Design Inspirations",
    id: 104,
    parentId: "1",
    dateAddedLocal: "03/11/2020, 11:49:57",
    dateAddedUTC: "2020-11-03T06:19:57.288Z",
  },
  {
    index: 0,
    title: "Corentin Bac - Front-end Developer",
    url: "http://corentinbac.com/en/projects",
    id: 105,
    parentId: "104",
    dateAddedLocal: "13/07/2017, 14:52:55",
    dateAddedUTC: "2017-07-13T09:22:55.605Z",
  },
  {
    index: 1,
    title: "100 Best Mobile App Interaction on Behance",
    url: "https://www.behance.net/gallery/53917017/100-Best-Mobile-App-Interaction",
    id: 106,
    parentId: "104",
    dateAddedLocal: "07/09/2017, 15:26:48",
    dateAddedUTC: "2017-09-07T09:56:48.105Z",
  },
  {
    index: 2,
    title: "TUI - Travellr - a friend of mine",
    url: "https://afriendofmine.nl/work/tui-travellr",
    id: 107,
    parentId: "104",
    dateAddedLocal: "21/10/2017, 19:17:38",
    dateAddedUTC: "2017-10-21T13:47:38.196Z",
  },
  {
    index: 3,
    title: "Campuswire",
    url: "https://campuswire.com/",
    id: 108,
    parentId: "104",
    dateAddedLocal: "04/09/2017, 18:25:15",
    dateAddedUTC: "2017-09-04T12:55:15.157Z",
  },
  {
    index: 4,
    title: "Time Tracking and Invocing tool for freelancers | Trackly",
    url: "https://tracklyapp.com/",
    id: 109,
    parentId: "104",
    dateAddedLocal: "17/02/2018, 12:35:05",
    dateAddedUTC: "2018-02-17T07:05:05.650Z",
  },
  {
    index: 5,
    title: "techtipsNapps",
    url: "http://www.techtipsnapps.com/",
    id: 110,
    parentId: "104",
    dateAddedLocal: "21/10/2016, 10:25:14",
    dateAddedUTC: "2016-10-21T04:55:14.008Z",
  },
  {
    index: 6,
    title: "SnippetsLab - The missing code snippets manager",
    url: "https://www.renfei.org/snippets-lab/",
    id: 111,
    parentId: "104",
    dateAddedLocal: "09/06/2018, 16:50:14",
    dateAddedUTC: "2018-06-09T11:20:14.221Z",
  },
  {
    index: 7,
    title: "color",
    url: "https://files.slack.com/files-pri/TBLCZTAHF-FCK9DS0LC/3.png",
    id: 112,
    parentId: "104",
    dateAddedLocal: "04/09/2018, 23:07:25",
    dateAddedUTC: "2018-09-04T17:37:25.886Z",
  },
  {
    index: 8,
    title: "Royalty free images, photos, and graphics | Adobe Stock",
    url: "https://stock.adobe.com/",
    id: 113,
    parentId: "104",
    dateAddedLocal: "19/10/2016, 15:17:01",
    dateAddedUTC: "2016-10-19T09:47:01.865Z",
  },
  {
    index: 9,
    title: "Illustrations | unDraw",
    url: "https://undraw.co/illustrations",
    id: 114,
    parentId: "104",
    dateAddedLocal: "03/05/2018, 12:53:00",
    dateAddedUTC: "2018-05-03T07:23:00.326Z",
  },
  {
    index: 10,
    title: "Wayplot",
    url: "https://wayplot.com/auth",
    id: 115,
    parentId: "104",
    dateAddedLocal: "29/12/2018, 23:40:51",
    dateAddedUTC: "2018-12-29T18:10:51.406Z",
  },
  {
    index: 11,
    title:
      "Learn React.js - Full Course for Beginners - Tutorial 2019 - YouTube",
    url: "https://www.youtube.com/watch?v=DLX62G4lc44",
    id: 116,
    parentId: "104",
    dateAddedLocal: "30/04/2019, 22:50:46",
    dateAddedUTC: "2019-04-30T17:20:46.830Z",
  },
  {
    index: 17,
    title: "Banks",
    id: 117,
    parentId: "1",
    dateAddedLocal: "03/11/2020, 11:49:57",
    dateAddedUTC: "2020-11-03T06:19:57.289Z",
  },
  {
    index: 0,
    title: "UBI Online Registration",
    url: "https://www.unionbankonline.co.in/corp/BANKAWAY?Action.UBIMobileUser.Online=Y&AppSignonBankId=026&AppType=corporate",
    id: 118,
    parentId: "117",
    dateAddedLocal: "29/01/2018, 19:06:27",
    dateAddedUTC: "2018-01-29T13:36:27.255Z",
  },
  {
    index: 18,
    title: "slackbot",
    id: 119,
    parentId: "1",
    dateAddedLocal: "03/11/2020, 11:49:57",
    dateAddedUTC: "2020-11-03T06:19:57.289Z",
  },
  {
    index: 0,
    title: "mishk0/slack-bot-api: Simple way to control your Slack Bot",
    url: "https://github.com/mishk0/slack-bot-api",
    id: 120,
    parentId: "119",
    dateAddedLocal: "08/11/2018, 15:00:31",
    dateAddedUTC: "2018-11-08T09:30:31.007Z",
  },
  {
    index: 1,
    title: "Real Time Messaging API | Slack",
    url: "https://api.slack.com/rtm",
    id: 121,
    parentId: "119",
    dateAddedLocal: "08/11/2018, 15:00:48",
    dateAddedUTC: "2018-11-08T09:30:48.335Z",
  },
  {
    index: 19,
    title: "Sindre Sorhus",
    url: "https://sindresorhus.com/",
    id: 122,
    parentId: "1",
    dateAddedLocal: "05/12/2018, 18:01:37",
    dateAddedUTC: "2018-12-05T12:31:37.312Z",
  },
  {
    index: 20,
    title:
      ".ember776, #ember776::before { width: 320px; height: 320px; } .ember776::before { padding-top: 100%; } @media (min-width: 736px) { .ember776, #ember776::before { width: 158px; height: 158px; } .ember776::before { padding-top: 100%; } } @media (min-width: ",
    url: "https://itunes.apple.com/in/app/google-authenticator/id388497605?mt=8",
    id: 123,
    parentId: "1",
    dateAddedLocal: "23/11/2018, 23:25:30",
    dateAddedUTC: "2018-11-23T17:55:30.573Z",
  },
  {
    index: 21,
    title: "Cleanslate",
    url: "http://cleanslatecss.com/",
    id: 124,
    parentId: "1",
    dateAddedLocal: "25/12/2018, 22:19:16",
    dateAddedUTC: "2018-12-25T16:49:16.886Z",
  },
  {
    index: 22,
    title: "Your generated favicon",
    url: "https://realfavicongenerator.net/favicon_result?file_id=p1d0mh3u36b9bh2317lm10da1je56#.XDR_9lUzbDc",
    id: 125,
    parentId: "1",
    dateAddedLocal: "08/01/2019, 16:20:06",
    dateAddedUTC: "2019-01-08T10:50:06.255Z",
  },
  {
    index: 23,
    title: "snipper react",
    id: 126,
    parentId: "1",
    dateAddedLocal: "03/11/2020, 11:49:57",
    dateAddedUTC: "2020-11-03T06:19:57.290Z",
  },
  {
    index: 0,
    title: "react-tag-input-1nelrc - StackBlitz",
    url: "https://stackblitz.com/edit/react-tag-input-1nelrc?file=style.css",
    id: 127,
    parentId: "126",
    dateAddedLocal: "10/01/2019, 01:00:18",
    dateAddedUTC: "2019-01-09T19:30:18.655Z",
  },
  {
    index: 1,
    title: "react-ace-editor - npm",
    url: "https://www.npmjs.com/package/react-ace-editor",
    id: 128,
    parentId: "126",
    dateAddedLocal: "10/01/2019, 01:02:57",
    dateAddedUTC: "2019-01-09T19:32:57.757Z",
  },
  {
    index: 2,
    title: "react-ace/Ace.md at master Â· securingsincity/react-ace",
    url: "https://github.com/securingsincity/react-ace/blob/master/docs/Ace.md",
    id: 129,
    parentId: "126",
    dateAddedLocal: "13/01/2019, 19:16:25",
    dateAddedUTC: "2019-01-13T13:46:25.762Z",
  },
  {
    index: 3,
    title: "Reactjs Tags Component",
    url: "https://codepen.io/zebapy/pen/mJVrwg?editors=0010",
    id: 130,
    parentId: "126",
    dateAddedLocal: "19/01/2019, 16:10:55",
    dateAddedUTC: "2019-01-19T10:40:55.036Z",
  },
  {
    index: 4,
    title:
      "Running GUI Applications inside Docker Containers â€“ Saravanan Sundaramoorthy â€“ Medium",
    url: "https://medium.com/@SaravSun/running-gui-applications-inside-docker-containers-83d65c0db110",
    id: 131,
    parentId: "126",
    dateAddedLocal: "08/04/2019, 11:21:40",
    dateAddedUTC: "2019-04-08T05:51:40.412Z",
  },
  {
    index: 5,
    title: "dailyhack/index.js at master Â· mddanishyusuf/dailyhack",
    url: "https://github.com/mddanishyusuf/dailyhack/blob/master/pages/index.js",
    id: 132,
    parentId: "126",
    dateAddedLocal: "09/04/2019, 15:06:41",
    dateAddedUTC: "2019-04-09T09:36:41.473Z",
  },
  {
    index: 24,
    title: "Setup React Native App on Cloud9 â€“ Ozcan Ovunc â€“ Medium",
    url: "https://medium.com/@ozcanovunc/setup-react-native-app-on-cloud9-2522cf398377",
    id: 133,
    parentId: "1",
    dateAddedLocal: "25/02/2019, 19:27:45",
    dateAddedUTC: "2019-02-25T13:57:45.179Z",
  },
  {
    index: 25,
    title:
      "aksonov/react-native-router-flux: The first declarative React Native router",
    url: "https://github.com/aksonov/react-native-router-flux",
    id: 134,
    parentId: "1",
    dateAddedLocal: "28/02/2019, 20:28:35",
    dateAddedUTC: "2019-02-28T14:58:35.381Z",
  },
  {
    index: 26,
    title:
      "How to use Outlook REST APIs in a JavaScript single-page app | Microsoft Docs",
    url: "https://docs.microsoft.com/en-us/outlook/rest/javascript-tutorial",
    id: 135,
    parentId: "1",
    dateAddedLocal: "22/01/2018, 15:08:21",
    dateAddedUTC: "2018-01-22T09:38:21.370Z",
  },
  {
    index: 27,
    title: "Outstanding minimalist apps for your Mac",
    url: "https://setapp.com/lifestyle/apps-for-minimalists",
    id: 136,
    parentId: "1",
    dateAddedLocal: "16/02/2020, 17:13:17",
    dateAddedUTC: "2020-02-16T11:43:17.800Z",
  },
  {
    index: 28,
    title: "jwell",
    url: "http://demo.roadthemes.com/monsta/",
    id: 137,
    parentId: "1",
    dateAddedLocal: "02/07/2020, 21:37:43",
    dateAddedUTC: "2020-07-02T16:07:43.551Z",
  },
  {
    index: 29,
    title: "snipfeedback",
    id: 138,
    parentId: "1",
    dateAddedLocal: "03/11/2020, 11:49:57",
    dateAddedUTC: "2020-11-03T06:19:57.291Z",
  },
  {
    index: 0,
    title:
      "puppeteer-full-page-screenshot/index.js at master Â· morteza-fsh/puppeteer-full-page-screenshot",
    url: "https://github.com/morteza-fsh/puppeteer-full-page-screenshot/blob/master/src/index.js",
    id: 139,
    parentId: "138",
    dateAddedLocal: "07/09/2020, 19:47:32",
    dateAddedUTC: "2020-09-07T14:17:32.679Z",
  },
  {
    index: 30,
    title: "Enulus",
    url: "https://enulus.com/",
    id: 140,
    parentId: "1",
    dateAddedLocal: "15/09/2020, 10:36:19",
    dateAddedUTC: "2020-09-15T05:06:19.240Z",
  },
  {
    index: 31,
    title: "Visual Feedback tools",
    id: 141,
    parentId: "1",
    dateAddedLocal: "03/11/2020, 11:49:57",
    dateAddedUTC: "2020-11-03T06:19:57.291Z",
  },
  {
    index: 0,
    title: "Bolt | The easiest way to collect design feedback",
    url: "https://www.usebolt.io/",
    id: 142,
    parentId: "141",
    dateAddedLocal: "18/09/2020, 10:53:16",
    dateAddedUTC: "2020-09-18T05:23:16.803Z",
  },
  {
    index: 1,
    title: "Markup.io: Easiest Way to Leave Feedback on Digital Content",
    url: "https://www.markup.io/",
    id: 143,
    parentId: "141",
    dateAddedLocal: "18/09/2020, 10:53:16",
    dateAddedUTC: "2020-09-18T05:23:16.804Z",
  },
  {
    index: 2,
    title:
      "Pastel | Fastest visual website feedback tool for web designers, developers and agencies",
    url: "https://usepastel.com/",
    id: 144,
    parentId: "141",
    dateAddedLocal: "18/09/2020, 10:53:16",
    dateAddedUTC: "2020-09-18T05:23:16.804Z",
  },
  {
    index: 3,
    title: "Red Pen",
    url: "https://redpen.io/",
    id: 145,
    parentId: "141",
    dateAddedLocal: "18/09/2020, 10:53:16",
    dateAddedUTC: "2020-09-18T05:23:16.804Z",
  },
  {
    index: 4,
    title: "Userback | Customer Feedback, Annotation & Bug Tracking Tool",
    url: "https://www.userback.io/",
    id: 146,
    parentId: "141",
    dateAddedLocal: "18/09/2020, 10:53:16",
    dateAddedUTC: "2020-09-18T05:23:16.805Z",
  },
  {
    index: 5,
    title:
      "Free website annotation tool for web developers, designers | zipBoard",
    url: "https://zipboard.co/",
    id: 147,
    parentId: "141",
    dateAddedLocal: "18/09/2020, 10:53:16",
    dateAddedUTC: "2020-09-18T05:23:16.805Z",
  },
  {
    index: 6,
    title: "Visual Feedback Tool |Â Usersnap",
    url: "https://usersnap.com/l/visual-feedback-tool#close",
    id: 148,
    parentId: "141",
    dateAddedLocal: "18/09/2020, 10:53:16",
    dateAddedUTC: "2020-09-18T05:23:16.805Z",
  },
  {
    index: 7,
    title: "Visual Feedback, Annotation & Bug Tracking Tool | BugHerd",
    url: "https://bugherd.com/",
    id: 149,
    parentId: "141",
    dateAddedLocal: "18/09/2020, 10:53:16",
    dateAddedUTC: "2020-09-18T05:23:16.848Z",
  },
  {
    index: 8,
    title: "Visual bug reporting and feedback tool Â· Ybug.io",
    url: "https://ybug.io/",
    id: 150,
    parentId: "141",
    dateAddedLocal: "18/09/2020, 10:53:16",
    dateAddedUTC: "2020-09-18T05:23:16.848Z",
  },
  {
    index: 9,
    title:
      "Email Integration - Bug Tracking &amp; Visual Feedback Tool | Marker",
    url: "https://marker.io/email",
    id: 151,
    parentId: "141",
    dateAddedLocal: "18/09/2020, 10:53:16",
    dateAddedUTC: "2020-09-18T05:23:16.848Z",
  },
  {
    index: 10,
    title:
      "Visual website feedback tools (examples and how they work) - Saber Feedback",
    url: "https://saberfeedback.com/visual-website-feedback-tools/",
    id: 152,
    parentId: "141",
    dateAddedLocal: "18/09/2020, 10:53:16",
    dateAddedUTC: "2020-09-18T05:23:16.848Z",
  },
  {
    index: 11,
    title: "nootiz. The visual feedback tool",
    url: "https://www.nootiz.com/en/",
    id: 153,
    parentId: "141",
    dateAddedLocal: "18/09/2020, 10:53:16",
    dateAddedUTC: "2020-09-18T05:23:16.849Z",
  },
  {
    index: 32,
    title:
      "What actually is CSS-in-JS?. CSS-in-JS refers to a collection ofâ€¦ | by Oleg Isonen | DailyJS | Medium",
    url: "https://medium.com/dailyjs/what-is-actually-css-in-js-f2f529a2757",
    id: 371,
    parentId: "1",
    dateAddedLocal: "06/11/2020, 12:36:38",
    dateAddedUTC: "2020-11-06T07:06:38.769Z",
  },
  {
    index: 0,
    title: "Marketing_Product_Kairn_Full2x.jpg (1536Ã—1037)",
    url: "https://techcrunch.com/wp-content/uploads/2020/05/Marketing_Product_Kairn_Full2x.jpg?resize=1536,1037",
    id: 400,
    parentId: "2",
    dateAddedLocal: "21/12/2020, 19:54:23",
    dateAddedUTC: "2020-12-21T14:24:23.845Z",
  },
  {
    index: 1,
    title:
      "Creating a React-based Electron application with electron-webpack | by Uday Hiwarale | JsPoint | Medium",
    url: "https://medium.com/jspoint/creating-a-react-based-electron-application-with-electron-webpack-c33817a6ddc",
    id: 452,
    parentId: "2",
    dateAddedLocal: "17/03/2021, 12:36:09",
    dateAddedUTC: "2021-03-17T07:06:09.889Z",
  },
  {
    index: 2,
    title: "UglifyJS 3: Online JavaScript minifier",
    url: "https://skalman.github.io/UglifyJS-online/",
    id: 454,
    parentId: "2",
    dateAddedLocal: "29/03/2021, 17:44:41",
    dateAddedUTC: "2021-03-29T12:14:41.410Z",
  },
  {
    index: 0,
    title: "25 feb",
    id: 428,
    parentId: "3",
    dateAddedLocal: "26/02/2021, 14:19:26",
    dateAddedUTC: "2021-02-26T08:49:26.447Z",
  },
  {
    index: 0,
    title: "Gumroad - Lapse",
    url: "https://gumroad.com/products/MldlW/edit#checkout",
    id: 438,
    parentId: "428",
    dateAddedLocal: "25/02/2021, 23:56:46",
    dateAddedUTC: "2021-02-25T18:26:46.328Z",
  },
  {
    index: 1,
    title: "Lapse",
    url: "https://gumroad.com/l/lapse_app",
    id: 441,
    parentId: "428",
    dateAddedLocal: "25/02/2021, 23:57:11",
    dateAddedUTC: "2021-02-25T18:27:11.158Z",
  },
  {
    index: 2,
    title: "Bereket Semagn",
    url: "https://bereket.dev/projects",
    id: 448,
    parentId: "428",
    dateAddedLocal: "25/02/2021, 23:57:28",
    dateAddedUTC: "2021-02-25T18:27:28.758Z",
  },
  {
    index: 3,
    title: "Snipcode | Instantly save todos,bookmarks,screenshots",
    url: "https://snipcode.achuth.dev/",
    id: 447,
    parentId: "428",
    dateAddedLocal: "25/02/2021, 23:57:41",
    dateAddedUTC: "2021-02-25T18:27:41.700Z",
  },
  {
    index: 4,
    title: "Snippy | Instantly save todos,bookmarks,screenshots",
    url: "https://snippy.achuth.dev/",
    id: 439,
    parentId: "428",
    dateAddedLocal: "25/02/2021, 23:57:47",
    dateAddedUTC: "2021-02-25T18:27:47.972Z",
  },
  {
    index: 5,
    title: "Figma",
    url: "https://www.figma.com/file/93hBZ7coheTXKlv2JpWM49/UIUXDX?node-id=2231%3A176",
    id: 437,
    parentId: "428",
    dateAddedLocal: "25/02/2021, 23:57:52",
    dateAddedUTC: "2021-02-25T18:27:52.054Z",
  },
  {
    index: 6,
    title: "Designer developer",
    url: "https://www-ipa5rakgr.vercel.app/",
    id: 436,
    parentId: "428",
    dateAddedLocal: "25/02/2021, 23:57:56",
    dateAddedUTC: "2021-02-25T18:27:56.868Z",
  },
  {
    index: 7,
    title: "Apptorium â€“ Here we create your Mac apps",
    url: "https://www.apptorium.com/",
    id: 444,
    parentId: "428",
    dateAddedLocal: "25/02/2021, 23:58:01",
    dateAddedUTC: "2021-02-25T18:28:01.240Z",
  },
  {
    index: 8,
    title: "publicspace.net - Better Software for the Mac",
    url: "https://www.publicspace.net/mac.html",
    id: 445,
    parentId: "428",
    dateAddedLocal: "25/02/2021, 23:58:05",
    dateAddedUTC: "2021-02-25T18:28:05.704Z",
  },
  {
    index: 9,
    title: "Collecta â€” Capture and organize your inspiration",
    url: "https://collecta.space/",
    id: 435,
    parentId: "428",
    dateAddedLocal: "25/02/2021, 23:58:10",
    dateAddedUTC: "2021-02-25T18:28:10.757Z",
  },
  {
    index: 10,
    title: "Appliku",
    url: "https://appliku.com/",
    id: 432,
    parentId: "428",
    dateAddedLocal: "25/02/2021, 23:58:15",
    dateAddedUTC: "2021-02-25T18:28:15.263Z",
  },
  {
    index: 11,
    title: "Pricing",
    url: "https://keygen.sh/pricing/",
    id: 431,
    parentId: "428",
    dateAddedLocal: "25/02/2021, 23:58:19",
    dateAddedUTC: "2021-02-25T18:28:19.010Z",
  },
  {
    index: 12,
    title: "rendezvous with cassidoo",
    url: "https://buttondown.email/cassidoo/archive",
    id: 443,
    parentId: "428",
    dateAddedLocal: "25/02/2021, 23:58:26",
    dateAddedUTC: "2021-02-25T18:28:26.599Z",
  },
  {
    index: 13,
    title: "CookieHub - Cookie Consent Management Platform (CMP)",
    url: "https://www.cookiehub.com/",
    id: 442,
    parentId: "428",
    dateAddedLocal: "25/02/2021, 23:58:30",
    dateAddedUTC: "2021-02-25T18:28:30.837Z",
  },
  {
    index: 14,
    title: "Hello!",
    url: "https://typhoon-celestial-mule.glitch.me/",
    id: 430,
    parentId: "428",
    dateAddedLocal: "25/02/2021, 23:58:37",
    dateAddedUTC: "2021-02-25T18:28:37.952Z",
  },
  {
    index: 15,
    title: "Pock: Widgets manager for MacBook Touch Bar",
    url: "https://pock.dev/",
    id: 434,
    parentId: "428",
    dateAddedLocal: "25/02/2021, 23:58:46",
    dateAddedUTC: "2021-02-25T18:28:46.017Z",
  },
  {
    index: 16,
    title:
      "Stack is a smart browser for internet multitaskers. Manage all your social media, messaging, e-mailing, and productivity apps from one place! | Stack",
    url: "https://stackbrowser.com/mobile",
    id: 446,
    parentId: "428",
    dateAddedLocal: "25/02/2021, 23:58:50",
    dateAddedUTC: "2021-02-25T18:28:50.552Z",
  },
  {
    index: 17,
    title: "Polypane, The Browser For Building.",
    url: "https://polypane.app/",
    id: 440,
    parentId: "428",
    dateAddedLocal: "25/02/2021, 23:58:54",
    dateAddedUTC: "2021-02-25T18:28:54.218Z",
  },
  {
    index: 18,
    title:
      "responsively-org/responsively-app: A modified web browser that helps in responsive web development. A web developer's must have dev-tool.",
    url: "https://github.com/responsively-org/responsively-app",
    id: 429,
    parentId: "428",
    dateAddedLocal: "25/02/2021, 23:58:57",
    dateAddedUTC: "2021-02-25T18:28:57.809Z",
  },
  {
    index: 19,
    title: "Floatie",
    url: "https://floatie.app/",
    id: 433,
    parentId: "428",
    dateAddedLocal: "25/02/2021, 23:59:08",
    dateAddedUTC: "2021-02-25T18:29:08.214Z",
  },
  {
    index: 20,
    title: "ipcRenderer | Electron",
    url: "https://www.electronjs.org/docs/api/ipc-renderer",
    id: 450,
    parentId: "428",
    dateAddedLocal: "12/03/2021, 21:57:12",
    dateAddedUTC: "2021-03-12T16:27:12.711Z",
  },
  {
    index: 1,
    title: "26 jan",
    id: 402,
    parentId: "3",
    dateAddedLocal: "26/01/2021, 14:30:00",
    dateAddedUTC: "2021-01-26T09:00:00.544Z",
  },
  {
    index: 0,
    title: "Nibble",
    url: "https://nibble.fm/?ref=producthunt",
    id: 407,
    parentId: "402",
    dateAddedLocal: "26/01/2021, 13:36:00",
    dateAddedUTC: "2021-01-26T08:06:00.127Z",
  },
  {
    index: 1,
    title: "On-demand front-end development - FastJam",
    url: "https://fastjam.dev/",
    id: 417,
    parentId: "402",
    dateAddedLocal: "26/01/2021, 13:36:26",
    dateAddedUTC: "2021-01-26T08:06:26.349Z",
  },
  {
    index: 2,
    title: "VEED grow",
    url: "https://www.veed.io/grow",
    id: 408,
    parentId: "402",
    dateAddedLocal: "26/01/2021, 13:36:29",
    dateAddedUTC: "2021-01-26T08:06:29.236Z",
  },
  {
    index: 3,
    title: "Late Checkout - a Substack by Greg Isenberg",
    url: "https://latecheckout.substack.com/p/why-the-future-of-startups-are-studios",
    id: 415,
    parentId: "402",
    dateAddedLocal: "26/01/2021, 13:36:40",
    dateAddedUTC: "2021-01-26T08:06:40.160Z",
  },
  {
    index: 4,
    title: "Demo widget - Upvoty",
    url: "https://www.upvoty.com/demo-widget/",
    id: 416,
    parentId: "402",
    dateAddedLocal: "26/01/2021, 13:36:47",
    dateAddedUTC: "2021-01-26T08:06:47.180Z",
  },
  {
    index: 5,
    title: "Product Â· Nolt",
    url: "https://nolt.io/product",
    id: 418,
    parentId: "402",
    dateAddedLocal: "26/01/2021, 13:36:52",
    dateAddedUTC: "2021-01-26T08:06:52.696Z",
  },
  {
    index: 6,
    title: "Feature Monkey",
    url: "https://www.featuremonkey.com/blog/",
    id: 414,
    parentId: "402",
    dateAddedLocal: "26/01/2021, 13:36:55",
    dateAddedUTC: "2021-01-26T08:06:55.647Z",
  },
  {
    index: 7,
    title: "Tipe: Powerful Headless CMS for Next.js Apps",
    url: "https://tipe.io/",
    id: 411,
    parentId: "402",
    dateAddedLocal: "26/01/2021, 13:36:58",
    dateAddedUTC: "2021-01-26T08:06:58.368Z",
  },
  {
    index: 8,
    title: "Electron Builder Action Â· Actions Â· GitHub Marketplace",
    url: "https://github.com/marketplace/actions/electron-builder-action",
    id: 420,
    parentId: "402",
    dateAddedLocal: "26/01/2021, 13:37:01",
    dateAddedUTC: "2021-01-26T08:07:01.320Z",
  },
  {
    index: 9,
    title: "Publish - electron-builder",
    url: "https://www.electron.build/configuration/publish.html#recommended-github-releases-workflow",
    id: 409,
    parentId: "402",
    dateAddedLocal: "26/01/2021, 13:37:05",
    dateAddedUTC: "2021-01-26T08:07:05.198Z",
  },
  {
    index: 10,
    title: "Releases Â· achuthhadnoor/lapse",
    url: "https://github.com/achuthhadnoor/lapse/tags",
    id: 413,
    parentId: "402",
    dateAddedLocal: "26/01/2021, 13:37:08",
    dateAddedUTC: "2021-01-26T08:07:08.478Z",
  },
  {
    index: 11,
    title: "Mobile DevCast | A podcast dedicated to mobile app development",
    url: "https://mobiledevcast.com/",
    id: 406,
    parentId: "402",
    dateAddedLocal: "26/01/2021, 13:42:24",
    dateAddedUTC: "2021-01-26T08:12:24.220Z",
  },
  {
    index: 12,
    title: "Muzzle - silence embarrassing notifications",
    url: "https://muzzleapp.com/",
    id: 410,
    parentId: "402",
    dateAddedLocal: "26/01/2021, 13:42:32",
    dateAddedUTC: "2021-01-26T08:12:32.573Z",
  },
  {
    index: 13,
    title: "Numb STUN/TURN Server",
    url: "http://numb.viagenie.ca/",
    id: 412,
    parentId: "402",
    dateAddedLocal: "26/01/2021, 13:42:38",
    dateAddedUTC: "2021-01-26T08:12:38.080Z",
  },
  {
    index: 14,
    title: "Using Capacitor with Ionic - Capacitor",
    url: "https://capacitorjs.com/docs/getting-started/with-ionic",
    id: 405,
    parentId: "402",
    dateAddedLocal: "26/01/2021, 13:42:45",
    dateAddedUTC: "2021-01-26T08:12:45.692Z",
  },
  {
    index: 15,
    title:
      "The Easiest Way for Web Developers to Build Mobile Apps - DEV Community ðŸ‘©\u200dðŸ’»ðŸ‘¨\u200dðŸ’»",
    url: "https://dev.to/ionic/the-easiest-way-for-web-developers-to-build-mobile-apps-1ih8",
    id: 404,
    parentId: "402",
    dateAddedLocal: "26/01/2021, 13:42:53",
    dateAddedUTC: "2021-01-26T08:12:53.474Z",
  },
  {
    index: 16,
    title: "Amrit Pal Singh | 3D Illustrations and Design Assets",
    url: "https://amritpaldesign.com/",
    id: 403,
    parentId: "402",
    dateAddedLocal: "26/01/2021, 13:43:05",
    dateAddedUTC: "2021-01-26T08:13:05.642Z",
  },
  {
    index: 17,
    title: "Dan Rowden - Product builder",
    url: "https://danrowden.com/",
    id: 419,
    parentId: "402",
    dateAddedLocal: "26/01/2021, 13:43:08",
    dateAddedUTC: "2021-01-26T08:13:08.733Z",
  },
  {
    index: 2,
    title: "Portfolio's",
    id: 380,
    parentId: "3",
    dateAddedLocal: "13/12/2020, 19:44:18",
    dateAddedUTC: "2020-12-13T14:14:18.299Z",
  },
  {
    index: 0,
    title: "UIUXDX",
    url: "https://www.notion.so/UIUXDX-f4250b3392ea4c6797022e1b4c1892e8",
    id: 383,
    parentId: "380",
    dateAddedLocal: "12/12/2020, 17:36:45",
    dateAddedUTC: "2020-12-12T12:06:45.258Z",
  },
  {
    index: 1,
    title: "Enulus - Clockit",
    url: "https://enulus.com/clockit",
    id: 395,
    parentId: "380",
    dateAddedLocal: "12/12/2020, 17:37:02",
    dateAddedUTC: "2020-12-12T12:07:02.957Z",
  },
  {
    index: 2,
    title: "Turing - Build Faster Than Ever With Vetted Remote Developers",
    url: "https://www.turing.com/",
    id: 388,
    parentId: "380",
    dateAddedLocal: "12/12/2020, 17:37:06",
    dateAddedUTC: "2020-12-12T12:07:06.013Z",
  },
  {
    index: 3,
    title: "iOS | Doo â€“ Get Things Done",
    url: "https://getdooapp.com/",
    id: 387,
    parentId: "380",
    dateAddedLocal: "12/12/2020, 17:37:07",
    dateAddedUTC: "2020-12-12T12:07:07.945Z",
  },
  {
    index: 4,
    title: "Home - Kushagra Gour- Creativity freak!",
    url: "https://kushagra.dev/",
    id: 386,
    parentId: "380",
    dateAddedLocal: "12/12/2020, 17:37:10",
    dateAddedUTC: "2020-12-12T12:07:10.020Z",
  },
  {
    index: 5,
    title: "Jan Losert | Product Designer &Â Webflow Expert",
    url: "https://www.janlosert.com/",
    id: 385,
    parentId: "380",
    dateAddedLocal: "12/12/2020, 17:37:11",
    dateAddedUTC: "2020-12-12T12:07:11.919Z",
  },
  {
    index: 6,
    title: "Brian Lovin",
    url: "https://brianlovin.com/",
    id: 398,
    parentId: "380",
    dateAddedLocal: "12/12/2020, 17:37:13",
    dateAddedUTC: "2020-12-12T12:07:13.933Z",
  },
  {
    index: 7,
    title: "Spec Â· Level Up",
    url: "https://spec.fm/",
    id: 392,
    parentId: "380",
    dateAddedLocal: "12/12/2020, 17:37:15",
    dateAddedUTC: "2020-12-12T12:07:15.727Z",
  },
  {
    index: 8,
    title: "Luke Oslizlo",
    url: "https://luke.af/",
    id: 389,
    parentId: "380",
    dateAddedLocal: "12/12/2020, 17:37:17",
    dateAddedUTC: "2020-12-12T12:07:17.635Z",
  },
  {
    index: 9,
    title: "Tabbs: Navigate Chrome tabs like a pro",
    url: "https://www.tabbs.pro/?ref=producthunt",
    id: 396,
    parentId: "380",
    dateAddedLocal: "12/12/2020, 17:37:19",
    dateAddedUTC: "2020-12-12T12:07:19.689Z",
  },
  {
    index: 10,
    title: "Product Designer in San Francisco - Moe Amaya",
    url: "https://moeamaya.com/",
    id: 384,
    parentId: "380",
    dateAddedLocal: "12/12/2020, 17:37:21",
    dateAddedUTC: "2020-12-12T12:07:21.643Z",
  },
  {
    index: 11,
    title: "Behance",
    url: "https://www.behance.net/isacrespo/",
    id: 391,
    parentId: "380",
    dateAddedLocal: "12/12/2020, 17:37:23",
    dateAddedUTC: "2020-12-12T12:07:23.475Z",
  },
  {
    index: 12,
    title: "Feature Monkey | Customer Feedback Management Tool",
    url: "https://www.featuremonkey.com/",
    id: 394,
    parentId: "380",
    dateAddedLocal: "12/12/2020, 17:37:25",
    dateAddedUTC: "2020-12-12T12:07:25.382Z",
  },
  {
    index: 13,
    title: "Achuth Hadnoor â€“ Developer, writer, maker.",
    url: "https://achuth.dev/",
    id: 397,
    parentId: "380",
    dateAddedLocal: "12/12/2020, 17:37:27",
    dateAddedUTC: "2020-12-12T12:07:27.545Z",
  },
  {
    index: 14,
    title: "Writing | Q",
    url: "https://jonquach.com/posts",
    id: 382,
    parentId: "380",
    dateAddedLocal: "12/12/2020, 17:37:29",
    dateAddedUTC: "2020-12-12T12:07:29.535Z",
  },
  {
    index: 15,
    title: "Homepage - KosmoTime",
    url: "https://www.kosmotime.com/",
    id: 390,
    parentId: "380",
    dateAddedLocal: "12/12/2020, 17:37:31",
    dateAddedUTC: "2020-12-12T12:07:31.344Z",
  },
  {
    index: 16,
    title:
      "KosmoTime - To Do List with Super Powersâ€” SPRINTS & DISTRACTION BLOCKING | Product Hunt",
    url: "https://www.producthunt.com/posts/kosmotime?utm_source=badge-featured&utm_medium=badge&utm_souce=badge-kosmotime",
    id: 393,
    parentId: "380",
    dateAddedLocal: "12/12/2020, 17:37:33",
    dateAddedUTC: "2020-12-12T12:07:33.746Z",
  },
  {
    index: 17,
    title: "Bookshelf - Mihai Serban",
    url: "https://www.mihaiserban.dev/bookshelf",
    id: 381,
    parentId: "380",
    dateAddedLocal: "12/12/2020, 17:37:35",
    dateAddedUTC: "2020-12-12T12:07:35.679Z",
  },
  {
    index: 18,
    title: "ImageOptim HTTP API for optimization on web servers",
    url: "https://imageoptim.com/api",
    id: 456,
    parentId: "380",
    dateAddedLocal: "25/04/2021, 14:51:31",
    dateAddedUTC: "2021-04-25T09:21:31.049Z",
  },
  {
    index: 3,
    title: "Vercel",
    id: 377,
    parentId: "3",
    dateAddedLocal: "08/12/2020, 18:35:15",
    dateAddedUTC: "2020-12-08T13:05:15.062Z",
  },
  {
    index: 0,
    title: "Background jobs on vercel",
    url: "https://quirrel.dev/",
    id: 378,
    parentId: "377",
    dateAddedLocal: "05/12/2020, 19:04:12",
    dateAddedUTC: "2020-12-05T13:34:12.060Z",
  },
  {
    index: 1,
    title: "HTTPie â€“ command-line HTTP client for the API era",
    url: "https://httpie.io/",
    id: 422,
    parentId: "377",
    dateAddedLocal: "15/02/2021, 19:30:54",
    dateAddedUTC: "2021-02-15T14:00:54.742Z",
  },
  {
    index: 4,
    title: "Test",
    id: 154,
    parentId: "3",
    dateAddedLocal: "03/11/2020, 11:49:57",
    dateAddedUTC: "2020-11-03T06:19:57.292Z",
  },
  {
    index: 0,
    title: "captur/build at master Â· achuthhadnoor/captur",
    url: "https://github.com/achuthhadnoor/captur/tree/master/build",
    id: 155,
    parentId: "154",
    dateAddedLocal: "02/08/2020, 21:28:05",
    dateAddedUTC: "2020-08-02T15:58:05.168Z",
  },
  {
    index: 1,
    title: "Want to Be More Productive? Try Doing Less.",
    url: "https://hbr-org.cdn.ampproject.org/c/s/hbr.org/amp/2020/05/want-to-be-more-productive-try-doing-less",
    id: 156,
    parentId: "154",
    dateAddedLocal: "02/08/2020, 21:28:22",
    dateAddedUTC: "2020-08-02T15:58:22.658Z",
  },
  {
    index: 2,
    title: "Designletter",
    url: "https://us10.campaign-archive.com/home/?u=ac670d4650872310b44fc59b4&id=2728fe6fff",
    id: 157,
    parentId: "154",
    dateAddedLocal: "02/08/2020, 21:28:54",
    dateAddedUTC: "2020-08-02T15:58:54.625Z",
  },
  {
    index: 3,
    title: "The Frontend Developer Career Path",
    url: "https://scrimba.com/path/gfrontend",
    id: 158,
    parentId: "154",
    dateAddedLocal: "02/08/2020, 21:28:59",
    dateAddedUTC: "2020-08-02T15:58:59.799Z",
  },
  {
    index: 4,
    title: "Building the Tailwind Blog with Next.js â€“ Tailwind CSS",
    url: "https://blog.tailwindcss.com/building-the-tailwind-blog",
    id: 159,
    parentId: "154",
    dateAddedLocal: "02/08/2020, 21:29:02",
    dateAddedUTC: "2020-08-02T15:59:02.111Z",
  },
  {
    index: 5,
    title: "Sign In - Apple",
    url: "https://idmsa.apple.com/IDMSWebAuth/signin.html?appIdKey=967e0c9eb29cb96878a15488726dd401bae3c121c2b0b124d9e6eb537387d235&path=/app/en-us/policy&rv=2&view=0",
    id: 160,
    parentId: "154",
    dateAddedLocal: "02/08/2020, 21:29:04",
    dateAddedUTC: "2020-08-02T15:59:04.879Z",
  },
  {
    index: 6,
    title: "Applications | Amazon.jobs",
    url: "https://account.amazon.jobs/en-US",
    id: 161,
    parentId: "154",
    dateAddedLocal: "02/08/2020, 21:29:07",
    dateAddedUTC: "2020-08-02T15:59:07.125Z",
  },
  {
    index: 7,
    title: "Apply to be a Careero Mentor",
    url: "https://getcareero.com/apply-to-mentor",
    id: 162,
    parentId: "154",
    dateAddedLocal: "02/08/2020, 21:29:10",
    dateAddedUTC: "2020-08-02T15:59:10.144Z",
  },
  {
    index: 8,
    title: "Buttondown - jamstackfns",
    url: "https://jamstackfns.com/f/buttondown",
    id: 163,
    parentId: "154",
    dateAddedLocal: "02/08/2020, 21:29:12",
    dateAddedUTC: "2020-08-02T15:59:12.964Z",
  },
  {
    index: 9,
    title:
      "Coursera | Online Courses & Credentials From Top Educators. Join for Free | Coursera",
    url: "https://www.coursera.org/learn/user-experience-design/exam/CWpTl/overview-of-user-experience-design/attempt",
    id: 164,
    parentId: "154",
    dateAddedLocal: "02/08/2020, 21:29:15",
    dateAddedUTC: "2020-08-02T15:59:15.081Z",
  },
  {
    index: 10,
    title:
      "How I earned $16K in 48 hours with my SaaS launch (Detailed breakdown)",
    url: "https://www.indiehackers.com/post/how-i-earned-16k-in-48-hours-with-my-saas-launch-detailed-breakdown-578ad8f767",
    id: 165,
    parentId: "154",
    dateAddedLocal: "02/08/2020, 21:29:17",
    dateAddedUTC: "2020-08-02T15:59:17.364Z",
  },
  {
    index: 11,
    title: "PoseNet - Camera Feed Demo",
    url: "https://pose-animator-demo.firebaseapp.com/camera.html",
    id: 166,
    parentId: "154",
    dateAddedLocal: "02/08/2020, 21:29:19",
    dateAddedUTC: "2020-08-02T15:59:19.454Z",
  },
  {
    index: 12,
    title: "Storybook for React tutorial | Storybook Tutorials",
    url: "https://www.learnstorybook.com/intro-to-storybook/react/en/get-started/",
    id: 167,
    parentId: "154",
    dateAddedLocal: "02/08/2020, 21:29:21",
    dateAddedUTC: "2020-08-02T15:59:21.661Z",
  },
  {
    index: 13,
    title: "Learn Next.js â€“ A free video course on React and Next.js.",
    url: "https://masteringnextjs.com/#course-overview",
    id: 168,
    parentId: "154",
    dateAddedLocal: "02/08/2020, 21:29:24",
    dateAddedUTC: "2020-08-02T15:59:24.001Z",
  },
  {
    index: 14,
    title: "https://tldl.app/2.mp4",
    url: "https://tldl.app/2.mp4",
    id: 169,
    parentId: "154",
    dateAddedLocal: "02/08/2020, 21:29:28",
    dateAddedUTC: "2020-08-02T15:59:28.273Z",
  },
  {
    index: 15,
    title: "https://tldl.app/4.mp4",
    url: "https://tldl.app/4.mp4",
    id: 170,
    parentId: "154",
    dateAddedLocal: "02/08/2020, 21:29:30",
    dateAddedUTC: "2020-08-02T15:59:30.504Z",
  },
  {
    index: 16,
    title: "https://tldl.app/1.mp4",
    url: "https://tldl.app/1.mp4",
    id: 171,
    parentId: "154",
    dateAddedLocal: "02/08/2020, 21:29:34",
    dateAddedUTC: "2020-08-02T15:59:34.295Z",
  },
  {
    index: 17,
    title: "https://tldl.app/3.mp4",
    url: "https://tldl.app/3.mp4",
    id: 172,
    parentId: "154",
    dateAddedLocal: "02/08/2020, 21:29:36",
    dateAddedUTC: "2020-08-02T15:59:36.276Z",
  },
  {
    index: 18,
    title: "Projects - Miguel Piedrafita",
    url: "https://miguelpiedrafita.com/projects",
    id: 173,
    parentId: "154",
    dateAddedLocal: "02/08/2020, 21:29:38",
    dateAddedUTC: "2020-08-02T15:59:38.126Z",
  },
  {
    index: 19,
    title: "I build my ideas from Jordan Singer",
    url: "https://ibuildmyideas.substack.com/",
    id: 174,
    parentId: "154",
    dateAddedLocal: "02/08/2020, 21:29:40",
    dateAddedUTC: "2020-08-02T15:59:40.070Z",
  },
  {
    index: 20,
    title: "GG| - Video Game Collection Tracker",
    url: "https://ggapp.io/",
    id: 175,
    parentId: "154",
    dateAddedLocal: "02/08/2020, 21:29:41",
    dateAddedUTC: "2020-08-02T15:59:41.918Z",
  },
  {
    index: 21,
    title: "Stack â€” Michael Karnjanaprakorn",
    url: "https://www.mikekarnj.com/stack",
    id: 176,
    parentId: "154",
    dateAddedLocal: "02/08/2020, 21:29:44",
    dateAddedUTC: "2020-08-02T15:59:44.033Z",
  },
  {
    index: 22,
    title: "Vidy Thatte (vidy)",
    url: "https://reading.supply/@vidy",
    id: 177,
    parentId: "154",
    dateAddedLocal: "02/08/2020, 21:29:46",
    dateAddedUTC: "2020-08-02T15:59:46.142Z",
  },
  {
    index: 23,
    title: "Lee Robinson â€“ Developer, writer, creator.",
    url: "https://leerob.io/",
    id: 178,
    parentId: "154",
    dateAddedLocal: "02/08/2020, 21:29:48",
    dateAddedUTC: "2020-08-02T15:59:48.202Z",
  },
  {
    index: 24,
    title: "Kyler Phillips - Product Designer",
    url: "https://kyler.design/",
    id: 179,
    parentId: "154",
    dateAddedLocal: "02/08/2020, 21:29:50",
    dateAddedUTC: "2020-08-02T15:59:50.209Z",
  },
  {
    index: 25,
    title: "Rameerez Startup Studio",
    url: "https://rameerez.com/",
    id: 180,
    parentId: "154",
    dateAddedLocal: "02/08/2020, 21:29:55",
    dateAddedUTC: "2020-08-02T15:59:55.311Z",
  },
  {
    index: 26,
    title: "Chethan KVS - Digital Product Designer",
    url: "https://www.chethankvs.design/#sideprojects",
    id: 181,
    parentId: "154",
    dateAddedLocal: "02/08/2020, 21:29:57",
    dateAddedUTC: "2020-08-02T15:59:57.481Z",
  },
  {
    index: 27,
    title: "Just JavaScript â€” a course by Dan Abramov and Maggie Appleton",
    url: "https://justjavascript.com/confirm",
    id: 182,
    parentId: "154",
    dateAddedLocal: "02/08/2020, 21:29:59",
    dateAddedUTC: "2020-08-02T15:59:59.331Z",
  },
  {
    index: 28,
    title: "Big Human | A Digital Product Studio That Goes Beyond",
    url: "https://bighuman.com/",
    id: 183,
    parentId: "154",
    dateAddedLocal: "02/08/2020, 21:30:01",
    dateAddedUTC: "2020-08-02T16:00:01.417Z",
  },
  {
    index: 29,
    title: "The Browser Company",
    url: "https://thebrowser.company/",
    id: 184,
    parentId: "154",
    dateAddedLocal: "02/08/2020, 21:30:03",
    dateAddedUTC: "2020-08-02T16:00:03.479Z",
  },
  {
    index: 30,
    title: "Electron Screen Capture Tutorial",
    url: "https://fireship.io/lessons/electron-screen-recorder-project-tutorial/",
    id: 185,
    parentId: "154",
    dateAddedLocal: "02/08/2020, 21:30:09",
    dateAddedUTC: "2020-08-02T16:00:09.585Z",
  },
  {
    index: 31,
    title:
      "react-figma-plugin-ds/src at master Â· alexandrtovmach/react-figma-plugin-ds",
    url: "https://github.com/alexandrtovmach/react-figma-plugin-ds/tree/master/src",
    id: 186,
    parentId: "154",
    dateAddedLocal: "02/08/2020, 21:30:11",
    dateAddedUTC: "2020-08-02T16:00:11.455Z",
  },
  {
    index: 32,
    title: "hovancik/stretchly: break time reminder app",
    url: "https://github.com/hovancik/stretchly",
    id: 187,
    parentId: "154",
    dateAddedLocal: "02/08/2020, 21:30:13",
    dateAddedUTC: "2020-08-02T16:00:13.157Z",
  },
  {
    index: 33,
    title: "https://www.designed.org/app/mentors",
    url: "https://www.designed.org/app/mentors",
    id: 188,
    parentId: "154",
    dateAddedLocal: "02/08/2020, 21:30:14",
    dateAddedUTC: "2020-08-02T16:00:14.922Z",
  },
  {
    index: 34,
    title: "Blake Robbins",
    url: "https://blakeir.com/Alex-Zhu-TikTok-4631f80fdcc4423a845e145e807d8e2b",
    id: 189,
    parentId: "154",
    dateAddedLocal: "02/08/2020, 21:30:16",
    dateAddedUTC: "2020-08-02T16:00:16.675Z",
  },
  {
    index: 35,
    title: "Adobe XDÂ Playoff: Design. Rebound. Win! by Adobe XD on Dribbble",
    url: "https://dribbble.com/shots/13823076-Adobe-XD-Playoff-Design-Rebound-Win?utm_campaign=announcement-603&utm_medium=banner&utm_source=dribbble",
    id: 190,
    parentId: "154",
    dateAddedLocal: "02/08/2020, 21:30:18",
    dateAddedUTC: "2020-08-02T16:00:18.362Z",
  },
  {
    index: 36,
    title: "OpenAI API",
    url: "https://beta.openai.com/",
    id: 191,
    parentId: "154",
    dateAddedLocal: "02/08/2020, 21:30:19",
    dateAddedUTC: "2020-08-02T16:00:19.976Z",
  },
  {
    index: 37,
    title: "commandly/src at master Â· achuthhadnoor/commandly",
    url: "https://github.com/achuthhadnoor/commandly/tree/master/src",
    id: 192,
    parentId: "154",
    dateAddedLocal: "02/08/2020, 21:30:21",
    dateAddedUTC: "2020-08-02T16:00:21.836Z",
  },
  {
    index: 38,
    title:
      "GetStream/Winds: A Beautiful Open Source RSS & Podcast App Powered by Getstream.io",
    url: "https://github.com/getstream/winds",
    id: 193,
    parentId: "154",
    dateAddedLocal: "02/08/2020, 21:30:23",
    dateAddedUTC: "2020-08-02T16:00:23.455Z",
  },
  {
    index: 39,
    title:
      "68747470733a2f2f692e696d6775722e636f6d2f416c56674454672e706e67 (1523Ã—990)",
    url: "https://camo.githubusercontent.com/ac9b04f1873b58fc1190bbf25f628af28a1b41a7/68747470733a2f2f692e696d6775722e636f6d2f416c56674454672e706e67",
    id: 194,
    parentId: "154",
    dateAddedLocal: "02/08/2020, 21:30:25",
    dateAddedUTC: "2020-08-02T16:00:25.272Z",
  },
  {
    index: 40,
    title: "fun-javascript-projects",
    url: "https://fun-javascript-projects.com/",
    id: 195,
    parentId: "154",
    dateAddedLocal: "02/08/2020, 21:30:26",
    dateAddedUTC: "2020-08-02T16:00:26.951Z",
  },
  {
    index: 41,
    title: "Just a moment...",
    url: "https://codepen.io/achuth/pen/qBbePLB",
    id: 196,
    parentId: "154",
    dateAddedLocal: "02/08/2020, 21:30:28",
    dateAddedUTC: "2020-08-02T16:00:28.720Z",
  },
  {
    index: 42,
    title: "Apple - Find Locations",
    url: "https://locate.apple.com/in/en/",
    id: 197,
    parentId: "154",
    dateAddedLocal: "02/08/2020, 21:30:30",
    dateAddedUTC: "2020-08-02T16:00:30.665Z",
  },
  {
    index: 43,
    title: "Figma",
    url: "https://www.figma.com/file/EakyvA6V94GtiMwlRDFmsUWn/Snipper?node-id=339%3A29",
    id: 198,
    parentId: "154",
    dateAddedLocal: "02/08/2020, 21:30:41",
    dateAddedUTC: "2020-08-02T16:00:41.655Z",
  },
  {
    index: 44,
    title: "DWorkS - Microstartup and Opensource apps",
    url: "https://dworks.io/",
    id: 199,
    parentId: "154",
    dateAddedLocal: "02/08/2020, 21:30:45",
    dateAddedUTC: "2020-08-02T16:00:45.551Z",
  },
  {
    index: 5,
    title: "Sap jobs",
    id: 200,
    parentId: "3",
    dateAddedLocal: "03/11/2020, 11:49:57",
    dateAddedUTC: "2020-11-03T06:19:57.295Z",
  },
  {
    index: 0,
    title: "Abap associate",
    url: "https://jobs.sap.com/job/Bangalore-ABAP-Developer-Associate-AIS-CRM-Job-KA/480216101/",
    id: 201,
    parentId: "200",
    dateAddedLocal: "17/06/2018, 11:16:35",
    dateAddedUTC: "2018-06-17T05:46:35.727Z",
  },
  {
    index: 1,
    title: "SAP ABAP Development for HANA",
    url: "https://www.accenture.com/in-en/careers/jobdetails?id=148579_india_1&utm_campaign=google_jobs_apply&utm_source=google_jobs_apply&utm_medium=organic",
    id: 202,
    parentId: "200",
    dateAddedLocal: "17/06/2018, 11:19:20",
    dateAddedUTC: "2018-06-17T05:49:20.554Z",
  },
  {
    index: 2,
    title: "SAP ABAP Development",
    url: "https://www.accenture.com/in-en/careers/jobdetails?id=144870_india_1&utm_campaign=google_jobs_apply&utm_source=google_jobs_apply&utm_medium=organic",
    id: 203,
    parentId: "200",
    dateAddedLocal: "17/06/2018, 11:22:58",
    dateAddedUTC: "2018-06-17T05:52:58.614Z",
  },
  {
    index: 6,
    title: "Stripe atlas",
    id: 204,
    parentId: "3",
    dateAddedLocal: "03/11/2020, 11:49:57",
    dateAddedUTC: "2020-11-03T06:19:57.296Z",
  },
  {
    index: 0,
    title:
      "https://email-74.stripe.com/t/ViewEmail/d/7CBF47E0EAC83A1F/61997CBFAA3A52A71A01488700E2614F",
    url: "https://email-74.stripe.com/t/ViewEmail/d/7CBF47E0EAC83A1F/61997CBFAA3A52A71A01488700E2614F",
    id: 205,
    parentId: "204",
    dateAddedLocal: "07/05/2018, 19:59:22",
    dateAddedUTC: "2018-05-07T14:29:22.498Z",
  },
  {
    index: 1,
    title:
      "https://email-74.stripe.com/t/ViewEmail/d/A272B3712923902A/61997CBFAA3A52A71A01488700E2614F",
    url: "https://email-74.stripe.com/t/ViewEmail/d/A272B3712923902A/61997CBFAA3A52A71A01488700E2614F",
    id: 206,
    parentId: "204",
    dateAddedLocal: "07/05/2018, 19:59:44",
    dateAddedUTC: "2018-05-07T14:29:44.280Z",
  },
  {
    index: 2,
    title:
      "https://email-74.stripe.com/t/ViewEmail/d/84D59D76FCFBB093/61997CBFAA3A52A71A01488700E2614F",
    url: "https://email-74.stripe.com/t/ViewEmail/d/84D59D76FCFBB093/61997CBFAA3A52A71A01488700E2614F",
    id: 207,
    parentId: "204",
    dateAddedLocal: "07/05/2018, 19:59:52",
    dateAddedUTC: "2018-05-07T14:29:52.833Z",
  },
  {
    index: 7,
    title: "Gre",
    id: 208,
    parentId: "3",
    dateAddedLocal: "03/11/2020, 11:49:57",
    dateAddedUTC: "2020-11-03T06:19:57.296Z",
  },
  {
    index: 0,
    title: "How to Study for the GRE in Two Months - Kaplan Test Prep",
    url: "https://www.kaptest.com/study/gre/how-to-study-for-the-gre-in-two-months/",
    id: 209,
    parentId: "208",
    dateAddedLocal: "08/04/2018, 13:26:07",
    dateAddedUTC: "2018-04-08T07:56:07.032Z",
  },
  {
    index: 8,
    title: "Pitch deck",
    id: 210,
    parentId: "3",
    dateAddedLocal: "03/11/2020, 11:49:57",
    dateAddedUTC: "2020-11-03T06:19:57.296Z",
  },
  {
    index: 0,
    title: "How to Design a Better Pitch Deck",
    url: "https://blog.ycombinator.com/how-to-design-a-better-pitch-deck/",
    id: 211,
    parentId: "210",
    dateAddedLocal: "13/03/2018, 08:30:49",
    dateAddedUTC: "2018-03-13T03:00:49.019Z",
  },
  {
    index: 1,
    title: "The YC Seed Deck Template",
    url: "https://blog.ycombinator.com/intro-to-the-yc-seed-deck/",
    id: 212,
    parentId: "210",
    dateAddedLocal: "13/03/2018, 08:29:46",
    dateAddedUTC: "2018-03-13T02:59:46.451Z",
  },
  {
    index: 9,
    title: "Machine learning",
    id: 213,
    parentId: "3",
    dateAddedLocal: "03/11/2020, 11:49:57",
    dateAddedUTC: "2020-11-03T06:19:57.296Z",
  },
  {
    index: 0,
    title:
      "Prerequisites and Prework Â |Â  Machine Learning Crash Course Â |Â  Google Developers",
    url: "https://developers.google.com/machine-learning/crash-course/prereqs-and-prework",
    id: 214,
    parentId: "213",
    dateAddedLocal: "02/03/2018, 08:47:36",
    dateAddedUTC: "2018-03-02T03:17:36.903Z",
  },
  {
    index: 1,
    title: "Uptime Robot",
    url: "https://uptimerobot.com/",
    id: 215,
    parentId: "213",
    dateAddedLocal: "29/10/2018, 11:30:51",
    dateAddedUTC: "2018-10-29T06:00:51.985Z",
  },
  {
    index: 10,
    title: "Studios",
    id: 216,
    parentId: "3",
    dateAddedLocal: "03/11/2020, 11:49:57",
    dateAddedUTC: "2020-11-03T06:19:57.296Z",
  },
  {
    index: 0,
    title: "Studio - Klopal â€“ Startup Studio",
    url: "https://www.klopal.com/studio/",
    id: 217,
    parentId: "216",
    dateAddedLocal: "21/02/2018, 08:50:32",
    dateAddedUTC: "2018-02-21T03:20:32.871Z",
  },
  {
    index: 1,
    title: "eFounders â€¢ We build the future of work",
    url: "https://www.efounders.co/",
    id: 218,
    parentId: "216",
    dateAddedLocal: "21/02/2018, 08:51:10",
    dateAddedUTC: "2018-02-21T03:21:10.592Z",
  },
  {
    index: 11,
    title: "Slite clone",
    id: 219,
    parentId: "3",
    dateAddedLocal: "03/11/2020, 11:49:57",
    dateAddedUTC: "2020-11-03T06:19:57.296Z",
  },
  {
    index: 0,
    title:
      "wildcard-subdomains/README.md at master Â· patmood/wildcard-subdomains",
    url: "https://github.com/patmood/wildcard-subdomains/blob/master/README.md",
    id: 220,
    parentId: "219",
    dateAddedLocal: "27/01/2018, 18:33:21",
    dateAddedUTC: "2018-01-27T13:03:21.913Z",
  },
  {
    index: 12,
    title: "Vuejs",
    id: 221,
    parentId: "3",
    dateAddedLocal: "03/11/2020, 11:49:57",
    dateAddedUTC: "2020-11-03T06:19:57.296Z",
  },
  {
    index: 0,
    title: "Introduction Â· GitBook",
    url: "http://router.vuejs.org/en/",
    id: 222,
    parentId: "221",
    dateAddedLocal: "10/07/2017, 17:12:22",
    dateAddedUTC: "2017-07-10T11:42:22.009Z",
  },
  {
    index: 1,
    title: "Introduction Â· Vuex",
    url: "https://vuex.vuejs.org/en/",
    id: 223,
    parentId: "221",
    dateAddedLocal: "10/07/2017, 17:13:41",
    dateAddedUTC: "2017-07-10T11:43:41.275Z",
  },
  {
    index: 2,
    title: "Project Structure Â· GitBook",
    url: "https://vuejs-templates.github.io/webpack/structure.html",
    id: 224,
    parentId: "221",
    dateAddedLocal: "01/07/2017, 17:35:28",
    dateAddedUTC: "2017-07-01T12:05:28.635Z",
  },
  {
    index: 3,
    title:
      "QurateInc/vue-pouch-db: Vue Pouch DB is a VueJS Plugin that binds PouchDB with Vue and keeps a synchronised state with the database. Has support for Mango queries which are processed locally within the VuePouchDB state.",
    url: "https://github.com/QurateInc/vue-pouch-db",
    id: 225,
    parentId: "221",
    dateAddedLocal: "13/07/2017, 12:08:38",
    dateAddedUTC: "2017-07-13T06:38:38.784Z",
  },
  {
    index: 4,
    title:
      "hiyali/vue-smooth-picker: ðŸ„ðŸ¼ A SmoothPicker for Vue 2 (like iOS native datetime picker )",
    url: "https://github.com/hiyali/vue-smooth-picker",
    id: 226,
    parentId: "221",
    dateAddedLocal: "13/07/2017, 16:16:12",
    dateAddedUTC: "2017-07-13T10:46:12.666Z",
  },
  {
    index: 5,
    title:
      "Vue.js 2 Quickstart Tutorial 2017 â€“ CodingTheSmartWay.com Blog â€“ Medium",
    url: "https://medium.com/codingthesmartway-com-blog/vue-js-2-quickstart-tutorial-2017-246195cfbdd2",
    id: 227,
    parentId: "221",
    dateAddedLocal: "04/08/2017, 13:32:19",
    dateAddedUTC: "2017-08-04T08:02:19.839Z",
  },
  {
    index: 6,
    title: "surmon-china/vue-awesome-swiper: ðŸ† Swiper component for Vue.",
    url: "https://github.com/surmon-china/vue-awesome-swiper",
    id: 228,
    parentId: "221",
    dateAddedLocal: "08/11/2017, 17:11:32",
    dateAddedUTC: "2017-11-08T11:41:32.181Z",
  },
  {
    index: 7,
    title: "User-switchable custom themes with Vue.js - Stack Overflow",
    url: "https://stackoverflow.com/questions/46730904/user-switchable-custom-themes-with-vue-js",
    id: 229,
    parentId: "221",
    dateAddedLocal: "24/03/2018, 11:05:53",
    dateAddedUTC: "2018-03-24T05:35:53.492Z",
  },
  {
    index: 8,
    title: "Dmitry Belyaev | Frontend Developer",
    url: "https://bananabobby.github.io/2017/03/07/bundle.html",
    id: 230,
    parentId: "221",
    dateAddedLocal: "11/05/2018, 10:32:44",
    dateAddedUTC: "2018-05-11T05:02:44.033Z",
  },
  {
    index: 9,
    title: "Vue-infinite-loading: An infinite scroll plugin for Vue.js",
    url: "https://peachscript.github.io/vue-infinite-loading/#!/getting-started",
    id: 231,
    parentId: "221",
    dateAddedLocal: "18/08/2018, 18:58:04",
    dateAddedUTC: "2018-08-18T13:28:04.000Z",
  },
  {
    index: 10,
    title: "Insomniaâ€™s Active Customers on Baremetrics",
    url: "https://insomnia.baremetrics.com/stats/active-customers#start_date=2016-11-07&end_date=2018-08-26",
    id: 232,
    parentId: "221",
    dateAddedLocal: "26/08/2018, 08:34:34",
    dateAddedUTC: "2018-08-26T03:04:34.665Z",
  },
  {
    index: 11,
    title: "Hybrid PlatformÂ Setup: Cordova + Vue + WebPack â€“ ITNEXT",
    url: "https://itnext.io/make-hybrid-platform-cordova-vue-webpack-2fb7031c4f9b",
    id: 233,
    parentId: "221",
    dateAddedLocal: "04/09/2018, 19:37:23",
    dateAddedUTC: "2018-09-04T14:07:23.530Z",
  },
  {
    index: 12,
    title: "Vue.js Kanban Board: The Development Process",
    url: "https://auth0.com/blog/vuejs-kanban-board-the-development-process/",
    id: 234,
    parentId: "221",
    dateAddedLocal: "04/09/2018, 19:48:38",
    dateAddedUTC: "2018-09-04T14:18:38.136Z",
  },
  {
    index: 13,
    title: "Offline webapp guide",
    url: "https://vuejsdevelopers.com/2017/10/09/vue-js-masonary-grid/",
    id: 235,
    parentId: "221",
    dateAddedLocal: "07/11/2017, 13:11:25",
    dateAddedUTC: "2017-11-07T07:41:25.556Z",
  },
  {
    index: 14,
    title:
      "Build complete RSS feed reader app - Front-end with Vue.js, Vuex & Element UI - QCode",
    url: "https://www.qcode.in/build-complete-rss-feed-reader-app-front-end-with-vue-js-vuex-element-ui/",
    id: 236,
    parentId: "221",
    dateAddedLocal: "05/09/2018, 17:21:51",
    dateAddedUTC: "2018-09-05T11:51:51.393Z",
  },
  {
    index: 15,
    title: "Liquor Tree",
    url: "https://amsik.github.io/liquor-tree/#Examples",
    id: 237,
    parentId: "221",
    dateAddedLocal: "30/09/2018, 12:18:15",
    dateAddedUTC: "2018-09-30T06:48:15.731Z",
  },
  {
    index: 16,
    title: "the-notifier/index.js at master Â· TheWebDevel/the-notifier",
    url: "https://github.com/TheWebDevel/the-notifier/blob/master/index.js",
    id: 238,
    parentId: "221",
    dateAddedLocal: "18/11/2018, 18:22:45",
    dateAddedUTC: "2018-11-18T12:52:45.969Z",
  },
  {
    index: 17,
    title: "Building an HTML template generator with tailwind.css",
    url: "https://blog.prototypr.io/building-an-html-template-generator-with-tailwind-css-63e8e4d32562",
    id: 239,
    parentId: "221",
    dateAddedLocal: "19/11/2018, 00:06:09",
    dateAddedUTC: "2018-11-18T18:36:09.405Z",
  },
  {
    index: 13,
    title: "How we built Twitter Lite | Twitter Blogs",
    url: "https://blog.twitter.com/2017/how-we-built-twitter-lite?utm_content=buffer101d8&utm_medium=social&utm_source=twitter.com&utm_campaign=buffer",
    id: 240,
    parentId: "3",
    dateAddedLocal: "08/04/2017, 21:38:14",
    dateAddedUTC: "2017-04-08T16:08:14.580Z",
  },
  {
    index: 14,
    title: "app8.gif (800Ã—600)",
    url: "https://cdn.dribbble.com/users/149817/screenshots/3167358/app8.gif",
    id: 241,
    parentId: "3",
    dateAddedLocal: "05/07/2017, 17:21:40",
    dateAddedUTC: "2017-07-05T11:51:40.055Z",
  },
  {
    index: 15,
    title: "text-animation3.gif (800Ã—600)",
    url: "https://cdn.dribbble.com/users/149817/screenshots/3461827/text-animation3.gif",
    id: 242,
    parentId: "3",
    dateAddedLocal: "05/07/2017, 17:21:46",
    dateAddedUTC: "2017-07-05T11:51:46.184Z",
  },
  {
    index: 16,
    title: "Y Combinator Funding Application",
    url: "https://dl.dropboxusercontent.com/u/27532820/app.html",
    id: 243,
    parentId: "3",
    dateAddedLocal: "07/07/2017, 11:28:51",
    dateAddedUTC: "2017-07-07T05:58:51.364Z",
  },
  {
    index: 17,
    title:
      "vuejs/awesome-vue: A curated list of awesome things related to Vue.js",
    url: "https://github.com/vuejs/awesome-vue#pull-to-refresh",
    id: 244,
    parentId: "3",
    dateAddedLocal: "13/07/2017, 14:59:24",
    dateAddedUTC: "2017-07-13T09:29:24.044Z",
  },
  {
    index: 18,
    title: "JavaScript OCR demo",
    url: "https://kdzwinel.github.io/JS-OCR-demo/",
    id: 245,
    parentId: "3",
    dateAddedLocal: "18/07/2017, 19:17:53",
    dateAddedUTC: "2017-07-18T13:47:53.597Z",
  },
  {
    index: 19,
    title: "Food Composition Databases Show API Help",
    url: "https://ndb.nal.usda.gov/ndb/doc/",
    id: 246,
    parentId: "3",
    dateAddedLocal: "29/08/2017, 17:21:05",
    dateAddedUTC: "2017-08-29T11:51:05.020Z",
  },
  {
    index: 20,
    title: "startup",
    id: 247,
    parentId: "3",
    dateAddedLocal: "03/11/2020, 11:49:57",
    dateAddedUTC: "2020-11-03T06:19:57.298Z",
  },
  {
    index: 0,
    title: "The Essential Guide to Growing Your Early-Stage SaaS Startup",
    url: "https://www.hotjar.com/grow-your-saas-startup/?ref=producthunt",
    id: 248,
    parentId: "247",
    dateAddedLocal: "31/08/2017, 15:01:31",
    dateAddedUTC: "2017-08-31T09:31:31.239Z",
  },
  {
    index: 1,
    title: "Vue-infinite-loading: An infinite scroll plugin for Vue.js",
    url: "https://peachscript.github.io/vue-infinite-loading/#!/properties",
    id: 249,
    parentId: "247",
    dateAddedLocal: "17/08/2018, 07:27:50",
    dateAddedUTC: "2018-08-17T01:57:50.266Z",
  },
  {
    index: 2,
    title: "You don't need a growth hacker",
    url: "https://andrewchen.co/you-dont-need-a-growth-hacker/",
    id: 250,
    parentId: "247",
    dateAddedLocal: "31/08/2018, 09:19:44",
    dateAddedUTC: "2018-08-31T03:49:44.719Z",
  },
  {
    index: 21,
    title: "chat app",
    id: 251,
    parentId: "3",
    dateAddedLocal: "03/11/2020, 11:49:57",
    dateAddedUTC: "2020-11-03T06:19:57.298Z",
  },
  {
    index: 0,
    title: "Artboard_Copy_2x.png (1600Ã—1200)",
    url: "https://cdn.dribbble.com/users/997070/screenshots/3773893/attachments/849976/Artboard_Copy_2x.png",
    id: 252,
    parentId: "251",
    dateAddedLocal: "18/09/2017, 17:05:46",
    dateAddedUTC: "2017-09-18T11:35:46.553Z",
  },
  {
    index: 1,
    title: "Dribbble - Show and tell for designers",
    url: "https://dribbble.com/search?q=Invisible+series",
    id: 253,
    parentId: "251",
    dateAddedLocal: "18/09/2017, 17:06:32",
    dateAddedUTC: "2017-09-18T11:36:32.219Z",
  },
  {
    index: 2,
    title: "30 Seconds of CSS",
    url: "https://atomiks.github.io/30-seconds-of-css/",
    id: 254,
    parentId: "251",
    dateAddedLocal: "20/05/2018, 22:34:51",
    dateAddedUTC: "2018-05-20T17:04:51.204Z",
  },
  {
    index: 3,
    title: "Fetchfeed - Hot Videos, Memes, GIFs and Breaking News",
    url: "https://fetchfeed.io/?ref=producthunt",
    id: 255,
    parentId: "251",
    dateAddedLocal: "02/06/2018, 23:06:32",
    dateAddedUTC: "2018-06-02T17:36:32.088Z",
  },
  {
    index: 22,
    title: "How to Research Your Business Idea - Entrepreneur.com",
    url: "https://www.entrepreneur.com/article/70518",
    id: 256,
    parentId: "3",
    dateAddedLocal: "14/12/2017, 10:07:56",
    dateAddedUTC: "2017-12-14T04:37:56.156Z",
  },
  {
    index: 23,
    title: "electron",
    id: 257,
    parentId: "3",
    dateAddedLocal: "03/11/2020, 11:49:57",
    dateAddedUTC: "2020-11-03T06:19:57.299Z",
  },
  {
    index: 0,
    title:
      "Building a Bookmarking App with Electron, VueJs, and Firebase | coligo",
    url: "https://coligo.io/bookmarking-app-electron-vuejs-firebase/",
    id: 258,
    parentId: "257",
    dateAddedLocal: "03/02/2018, 14:35:14",
    dateAddedUTC: "2018-02-03T09:05:14.703Z",
  },
  {
    index: 1,
    title: "eva-icons/README.md at master Â· akveo/eva-icons",
    url: "https://github.com/akveo/eva-icons/blob/master/README.md",
    id: 259,
    parentId: "257",
    dateAddedLocal: "04/11/2018, 20:21:18",
    dateAddedUTC: "2018-11-04T14:51:18.889Z",
  },
  {
    index: 2,
    title: "Creating email templates with React components : Assertible",
    url: "https://assertible.com/blog/creating-email-templates-with-react-components",
    id: 260,
    parentId: "257",
    dateAddedLocal: "21/04/2019, 17:50:16",
    dateAddedUTC: "2019-04-21T12:20:16.428Z",
  },
  {
    index: 3,
    title: "Productivity Apps - MacMenuBar.com",
    url: "https://macmenubar.com/productivity-apps/",
    id: 261,
    parentId: "257",
    dateAddedLocal: "28/04/2019, 20:59:18",
    dateAddedUTC: "2019-04-28T15:29:18.322Z",
  },
  {
    index: 4,
    title:
      "https://www.youtube.com/redirect/?q=https%3A%2F%2Fgist.github.com%2Fbradtraversy%2Fcd90d1ed3c462fe3bddd11bf8953a896&redir_token=e65ziIN0wJ-kUuum47uHRfjz7b58MTU2OTMzNTQxN0AxNTY5MjQ5MDE3&html_redirect=1&event=video_description&v=oykl1Ih9pMg",
    url: "https://www.youtube.com/redirect/?q=https%3A%2F%2Fgist.github.com%2Fbradtraversy%2Fcd90d1ed3c462fe3bddd11bf8953a896&redir_token=e65ziIN0wJ-kUuum47uHRfjz7b58MTU2OTMzNTQxN0AxNTY5MjQ5MDE3&html_redirect=1&event=video_description&v=oykl1Ih9pMg",
    id: 262,
    parentId: "257",
    dateAddedLocal: "23/09/2019, 20:00:21",
    dateAddedUTC: "2019-09-23T14:30:21.393Z",
  },
  {
    index: 5,
    title:
      "Implement Paypal in React Native without back-end - Tonynguyenit - Medium",
    url: "https://medium.com/@tonynguyenit18/implement-paypal-without-back-end-in-react-native-4edf949287b6",
    id: 263,
    parentId: "257",
    dateAddedLocal: "05/10/2019, 20:37:51",
    dateAddedUTC: "2019-10-05T15:07:51.070Z",
  },
  {
    index: 6,
    title: "Electron Release workflow for GitHub Actions",
    url: "https://gist.github.com/azu/673426500458f63f019c8f5e013f282a",
    id: 264,
    parentId: "257",
    dateAddedLocal: "28/10/2019, 21:34:09",
    dateAddedUTC: "2019-10-28T16:04:09.924Z",
  },
  {
    index: 7,
    title: "hazel/README.md at master Â· zeit/hazel",
    url: "https://github.com/zeit/hazel/blob/master/README.md",
    id: 265,
    parentId: "257",
    dateAddedLocal: "16/12/2019, 23:54:05",
    dateAddedUTC: "2019-12-16T18:24:05.552Z",
  },
  {
    index: 8,
    title: "leo/electron-next: Build Electron apps using Next.js",
    url: "https://github.com/leo/electron-next",
    id: 266,
    parentId: "257",
    dateAddedLocal: "17/12/2019, 00:11:30",
    dateAddedUTC: "2019-12-16T18:41:30.247Z",
  },
  {
    index: 9,
    title:
      "Next.js + Styled Components The Really Simple Guide â–² + ðŸ’… - DEV Community ðŸ‘©\u200dðŸ’»ðŸ‘¨\u200dðŸ’»",
    url: "https://dev.to/aprietof/nextjs--styled-components-the-really-simple-guide----101c",
    id: 267,
    parentId: "257",
    dateAddedLocal: "29/12/2019, 11:57:42",
    dateAddedUTC: "2019-12-29T06:27:42.886Z",
  },
  {
    index: 24,
    title: "Tools to help with your new startup - Startup with Google",
    url: "https://startup.google.com/?ref=producthunt",
    id: 268,
    parentId: "3",
    dateAddedLocal: "05/02/2018, 20:31:35",
    dateAddedUTC: "2018-02-05T15:01:35.239Z",
  },
  {
    index: 25,
    title: "Tet",
    url: "https://tet.launchaco.com/?ref=producthunt",
    id: 269,
    parentId: "3",
    dateAddedLocal: "11/02/2018, 18:09:09",
    dateAddedUTC: "2018-02-11T12:39:09.047Z",
  },
  {
    index: 26,
    title: "Swirrl Blog | Creating Asynchronous, Embeddable JavaScript Widgets",
    url: "http://blog.swirrl.com/articles/creating-asynchronous-embeddable-javascript-widgets/",
    id: 270,
    parentId: "3",
    dateAddedLocal: "27/02/2018, 14:16:14",
    dateAddedUTC: "2018-02-27T08:46:14.585Z",
  },
  {
    index: 27,
    title: "Figma",
    url: "https://www.figma.com/proto/N32yOYtvtgOWyIKvMrtWDXMV/Chat-app?node-id=963%3A254&scaling=contain",
    id: 271,
    parentId: "3",
    dateAddedLocal: "06/03/2018, 13:24:27",
    dateAddedUTC: "2018-03-06T07:54:27.155Z",
  },
  {
    index: 28,
    title: "Send SMS with NodeJS and Twilio API",
    url: "https://evdokimovm.github.io/javascript/nodejs/twilio/api/2016/08/07/Send-SMS-with-NodeJS-and-Twilio-API.html",
    id: 272,
    parentId: "3",
    dateAddedLocal: "09/03/2018, 20:00:39",
    dateAddedUTC: "2018-03-09T14:30:39.781Z",
  },
  {
    index: 29,
    title: "Supernova Studio",
    url: "https://supernova.studio/",
    id: 273,
    parentId: "3",
    dateAddedLocal: "13/03/2018, 15:07:53",
    dateAddedUTC: "2018-03-13T09:37:53.888Z",
  },
  {
    index: 30,
    title: "Shahid Shaikh",
    url: "https://shahidshaikh.com/",
    id: 274,
    parentId: "3",
    dateAddedLocal: "20/03/2018, 21:58:14",
    dateAddedUTC: "2018-03-20T16:28:14.185Z",
  },
  {
    index: 31,
    title: "GRE",
    id: 275,
    parentId: "3",
    dateAddedLocal: "03/11/2020, 11:49:57",
    dateAddedUTC: "2020-11-03T06:19:57.300Z",
  },
  {
    index: 0,
    title: "GRE revised General Test: Khan Academy Free Test Preparation",
    url: "https://www.ets.org/gre/revised_general/prepare/khan_academy",
    id: 276,
    parentId: "275",
    dateAddedLocal: "23/03/2018, 17:18:57",
    dateAddedUTC: "2018-03-23T11:48:57.631Z",
  },
  {
    index: 32,
    title: "Effortless",
    url: "https://www.tryeffortless.com/?ref=producthunt",
    id: 277,
    parentId: "3",
    dateAddedLocal: "07/04/2018, 17:50:19",
    dateAddedUTC: "2018-04-07T12:20:19.211Z",
  },
  {
    index: 33,
    title: "Cronhub - Painless Cron Monitoring Tool",
    url: "https://cronhub.io/?ref=producthunt",
    id: 278,
    parentId: "3",
    dateAddedLocal: "08/04/2018, 20:01:07",
    dateAddedUTC: "2018-04-08T14:31:07.531Z",
  },
  {
    index: 34,
    title: "Post a new project - Squeek",
    url: "https://www.squeek.io/post/new",
    id: 279,
    parentId: "3",
    dateAddedLocal: "12/04/2018, 09:35:39",
    dateAddedUTC: "2018-04-12T04:05:39.354Z",
  },
  {
    index: 35,
    title:
      "Notority - Take the control of your reputation | Online customer review | Review generation | Review management",
    url: "https://www.notority.com/?ref=producthunt",
    id: 280,
    parentId: "3",
    dateAddedLocal: "29/04/2018, 16:46:55",
    dateAddedUTC: "2018-04-29T11:16:55.495Z",
  },
  {
    index: 36,
    title: "New Post â€” Write.as",
    url: "https://write.as/new",
    id: 281,
    parentId: "3",
    dateAddedLocal: "08/05/2018, 16:11:28",
    dateAddedUTC: "2018-05-08T10:41:28.358Z",
  },
  {
    index: 37,
    title:
      "Creating a Side Project - 8 Stages, 43 Strategies & 59 Tools.pdf - Google Drive",
    url: "https://drive.google.com/file/d/1yVp8BO11Ijt44J8Nn95SD7XjvzrLBJaU/view",
    id: 282,
    parentId: "3",
    dateAddedLocal: "21/05/2018, 18:51:25",
    dateAddedUTC: "2018-05-21T13:21:25.468Z",
  },
  {
    index: 38,
    title:
      "I built a Progressive Web App and published it in 3 app stores. Hereâ€™s what I learned.",
    url: "https://medium.freecodecamp.org/i-built-a-pwa-and-published-it-in-3-app-stores-heres-what-i-learned-7cb3f56daf9b",
    id: 283,
    parentId: "3",
    dateAddedLocal: "29/05/2018, 17:12:24",
    dateAddedUTC: "2018-05-29T11:42:24.048Z",
  },
  {
    index: 39,
    title: "Create a chrome plugin with Python â€“ Python Tutorial",
    url: "https://pythonspot.com/create-a-chrome-plugin-with-python/",
    id: 284,
    parentId: "3",
    dateAddedLocal: "01/06/2018, 15:59:28",
    dateAddedUTC: "2018-06-01T10:29:28.924Z",
  },
  {
    index: 40,
    title:
      "Westworld - Season 1 | Watch Westworld - Season 1 FULL Free Online HD | CMOVIESHD.COM",
    url: "https://cmovieshd.bz/film/westworld-season-1/watching.html?ep=1",
    id: 285,
    parentId: "3",
    dateAddedLocal: "18/06/2018, 20:38:36",
    dateAddedUTC: "2018-06-18T15:08:36.732Z",
  },
  {
    index: 41,
    title: "Snipper landing",
    url: "https://k98pqpry1o.codesandbox.io/",
    id: 286,
    parentId: "3",
    dateAddedLocal: "22/06/2018, 19:54:24",
    dateAddedUTC: "2018-06-22T14:24:24.800Z",
  },
  {
    index: 42,
    title: "Tata Sky Dhamaka Pack â€“ 220+ Channels plus One Free Regional Pack",
    url: "https://www.tatasky.com/wps/portal/TataSky/tata_sky_dhamaka_pack",
    id: 287,
    parentId: "3",
    dateAddedLocal: "27/06/2018, 23:41:57",
    dateAddedUTC: "2018-06-27T18:11:57.732Z",
  },
  {
    index: 43,
    title: "8x6musico.jpg (800Ã—600)",
    url: "https://cdn.dribbble.com/users/1054174/screenshots/3682719/8x6musico.jpg",
    id: 288,
    parentId: "3",
    dateAddedLocal: "12/07/2018, 00:59:50",
    dateAddedUTC: "2018-07-11T19:29:50.700Z",
  },
  {
    index: 44,
    title: "Plasso â€“ SaaS",
    url: "https://plasso.com/industries/saas",
    id: 289,
    parentId: "3",
    dateAddedLocal: "16/07/2018, 18:04:36",
    dateAddedUTC: "2018-07-16T12:34:36.394Z",
  },
  {
    index: 45,
    title: "tazo",
    id: 290,
    parentId: "3",
    dateAddedLocal: "03/11/2020, 11:49:57",
    dateAddedUTC: "2020-11-03T06:19:57.301Z",
  },
  {
    index: 0,
    title: "Teamweek: Free Visual Resource Planning, Team Calendar",
    url: "https://teamweek.com/",
    id: 291,
    parentId: "290",
    dateAddedLocal: "18/07/2018, 19:07:05",
    dateAddedUTC: "2018-07-18T13:37:05.085Z",
  },
  {
    index: 1,
    title: "Soloflow",
    url: "https://soloflow.io/app/dashboard/invoices",
    id: 292,
    parentId: "290",
    dateAddedLocal: "18/07/2018, 19:07:24",
    dateAddedUTC: "2018-07-18T13:37:24.580Z",
  },
  {
    index: 2,
    title:
      "flowmagic | Very simple payment and time tracking tool for freelancers",
    url: "https://flowmagic.co/analytics/5ad5f7238ec5a804f81cd5a2/home",
    id: 293,
    parentId: "290",
    dateAddedLocal: "18/07/2018, 19:07:30",
    dateAddedUTC: "2018-07-18T13:37:30.359Z",
  },
  {
    index: 3,
    title: "Kreativa Studio - dashX",
    url: "http://www.kreativa-studio.com/work/dashx/67",
    id: 294,
    parentId: "290",
    dateAddedLocal: "18/07/2018, 19:09:42",
    dateAddedUTC: "2018-07-18T13:39:42.472Z",
  },
  {
    index: 46,
    title:
      "Free Vector Line Icons (SVG, PNG, PSD, CSH, EPS, Icon Font and more)",
    url: "https://linearicons.com/free",
    id: 295,
    parentId: "3",
    dateAddedLocal: "24/07/2018, 22:41:23",
    dateAddedUTC: "2018-07-24T17:11:23.513Z",
  },
  {
    index: 48,
    title: "Launch Feed",
    url: "http://www.launchfeed.com/",
    id: 297,
    parentId: "3",
    dateAddedLocal: "03/08/2018, 07:57:36",
    dateAddedUTC: "2018-08-03T02:27:36.392Z",
  },
  {
    index: 49,
    title: "rssfeedapp",
    url: "https://www.loggly.com/blog/newsletters-for-developers-and-programmers/",
    id: 298,
    parentId: "3",
    dateAddedLocal: "27/08/2018, 15:08:10",
    dateAddedUTC: "2018-08-27T09:38:10.652Z",
  },
  {
    index: 50,
    title: "Building a Site in 24 Hours and Growing it to +$2M/Year",
    url: "https://www.failory.com/mistakes/gadget-flow",
    id: 299,
    parentId: "3",
    dateAddedLocal: "30/08/2018, 09:30:18",
    dateAddedUTC: "2018-08-30T04:00:18.227Z",
  },
  {
    index: 51,
    title: "Gpay",
    url: "https://codepen.io/achuth/pen/JaWjPq",
    id: 300,
    parentId: "3",
    dateAddedLocal: "01/09/2018, 09:39:22",
    dateAddedUTC: "2018-09-01T04:09:22.240Z",
  },
  {
    index: 52,
    title: "rss link",
    url: "https://github.com/sourceful/linkdump/blob/master/rss-opml.xml",
    id: 301,
    parentId: "3",
    dateAddedLocal: "03/09/2018, 17:21:03",
    dateAddedUTC: "2018-09-03T11:51:03.994Z",
  },
  {
    index: 53,
    title: "An Anonymous Pen on CodePen",
    url: "https://codepen.io/anon/pen/RYjaQZ?editors=1010",
    id: 302,
    parentId: "3",
    dateAddedLocal: "07/09/2018, 17:26:26",
    dateAddedUTC: "2018-09-07T11:56:26.394Z",
  },
  {
    index: 54,
    title: "Build Native Mobile Apps with Flutter | Udacity",
    url: "https://in.udacity.com/course/build-native-mobile-apps-with-flutter--ud905",
    id: 303,
    parentId: "3",
    dateAddedLocal: "14/10/2018, 22:48:40",
    dateAddedUTC: "2018-10-14T17:18:40.496Z",
  },
  {
    index: 55,
    title: "A thread written by @wimgz",
    url: "https://threader.app/thread/1060985829789786112",
    id: 304,
    parentId: "3",
    dateAddedLocal: "11/11/2018, 06:41:52",
    dateAddedUTC: "2018-11-11T01:11:52.175Z",
  },
  {
    index: 56,
    title: "reactjs",
    id: 305,
    parentId: "3",
    dateAddedLocal: "03/11/2020, 11:49:57",
    dateAddedUTC: "2020-11-03T06:19:57.302Z",
  },
  {
    index: 0,
    title: "Building a Chrome Extension Using React â€“ Gil Fink â€“ Medium",
    url: "https://medium.com/@gilfink/building-a-chrome-extension-using-react-c5bfe45aaf36",
    id: 306,
    parentId: "305",
    dateAddedLocal: "16/11/2018, 19:00:34",
    dateAddedUTC: "2018-11-16T13:30:34.203Z",
  },
  {
    index: 1,
    title:
      "Takeaways on Building a React Based App with Electron - The Stream Blog",
    url: "https://getstream.io/blog/takeaways-on-building-a-react-based-app-with-electron/",
    id: 307,
    parentId: "305",
    dateAddedLocal: "16/11/2018, 19:06:48",
    dateAddedUTC: "2018-11-16T13:36:48.993Z",
  },
  {
    index: 2,
    title:
      "How Stream Built a Modern RSS Reader With JavaScript - Stream Tech Stack | StackShare",
    url: "https://stackshare.io/stream/how-stream-built-a-modern-rss-reader-with-javascript",
    id: 308,
    parentId: "305",
    dateAddedLocal: "16/11/2018, 23:54:23",
    dateAddedUTC: "2018-11-16T18:24:23.487Z",
  },
  {
    index: 3,
    title: "The Engine That Powers Winds ðŸš‚ - The Stream Blog",
    url: "https://getstream.io/blog/the-engine-that-powers-winds/",
    id: 309,
    parentId: "305",
    dateAddedLocal: "17/11/2018, 11:50:47",
    dateAddedUTC: "2018-11-17T06:20:47.210Z",
  },
  {
    index: 4,
    title: "How to do this in Flutter?",
    url: "https://howtodothisinflutter.com/#table-of-contents",
    id: 310,
    parentId: "305",
    dateAddedLocal: "18/12/2018, 11:03:25",
    dateAddedUTC: "2018-12-18T05:33:25.932Z",
  },
  {
    index: 5,
    title: "segmentio/create-next-app: Create Next.js apps in one command",
    url: "https://github.com/segmentio/create-next-app",
    id: 311,
    parentId: "305",
    dateAddedLocal: "18/12/2018, 17:24:45",
    dateAddedUTC: "2018-12-18T11:54:45.142Z",
  },
  {
    index: 57,
    title: "Building a Node.js Powered API with Express, Mongoose & MongoDB",
    url: "https://hackernoon.com/building-a-node-js-powered-api-with-express-mongoose-mongodb-19b14fd4b51e",
    id: 312,
    parentId: "3",
    dateAddedLocal: "05/09/2018, 19:52:00",
    dateAddedUTC: "2018-09-05T14:22:00.910Z",
  },
  {
    index: 58,
    title: "Building a RSS Viewer With Vue: Part 1 | CSS-Tricks",
    url: "https://css-tricks.com/building-a-rss-viewer-with-vue-part-1/",
    id: 313,
    parentId: "3",
    dateAddedLocal: "02/09/2018, 19:20:46",
    dateAddedUTC: "2018-09-02T13:50:46.687Z",
  },
  {
    index: 59,
    title: "The Road to React with Firebase",
    url: "https://roadtoreact.com/course-details?courseId=THE_ROAD_TO_REACT_WITH_FIREBASE",
    id: 314,
    parentId: "3",
    dateAddedLocal: "08/02/2019, 20:30:51",
    dateAddedUTC: "2019-02-08T15:00:51.723Z",
  },
  {
    index: 60,
    title: "Unubo - Refined startup metrics",
    url: "https://unubo.com/",
    id: 315,
    parentId: "3",
    dateAddedLocal: "15/02/2019, 08:36:32",
    dateAddedUTC: "2019-02-15T03:06:32.908Z",
  },
  {
    index: 61,
    title: "360 Degree Tour - GraphQL API | GraphQL 360",
    url: "https://graphql360.com/",
    id: 316,
    parentId: "3",
    dateAddedLocal: "15/02/2019, 19:38:52",
    dateAddedUTC: "2019-02-15T14:08:52.594Z",
  },
  {
    index: 62,
    title: "Glitch",
    url: "https://glitch.com/",
    id: 317,
    parentId: "3",
    dateAddedLocal: "07/03/2019, 16:38:26",
    dateAddedUTC: "2019-03-07T11:08:26.035Z",
  },
  {
    index: 63,
    title: "Emoji CSS",
    url: "https://afeld.github.io/emoji-css/",
    id: 318,
    parentId: "3",
    dateAddedLocal: "08/03/2019, 19:29:05",
    dateAddedUTC: "2019-03-08T13:59:05.500Z",
  },
  {
    index: 64,
    title: "Journal",
    url: "https://usejournal.com/?utm_source=medium.com&utm_medium=noteworthy_blog&utm_campaign=guest_post_image",
    id: 319,
    parentId: "3",
    dateAddedLocal: "16/03/2019, 20:41:47",
    dateAddedUTC: "2019-03-16T15:11:47.480Z",
  },
  {
    index: 65,
    title:
      "HOW TO GET RICH IN EUROPEAN TECH: These Guys Clone US Startups In Europe And Then Sell Them To The US Companies - Business Insider",
    url: "https://www.businessinsider.com/what-do-ebay-facebook-and-groupon-have-in-common-these-guys-cloned-them-and-got-rich-doing-it-2011-1?IR=T#they-found-an-excuse-to-interview-the-valleys-elite-a-senior-thesis-1",
    id: 320,
    parentId: "3",
    dateAddedLocal: "29/03/2019, 00:24:18",
    dateAddedUTC: "2019-03-28T18:54:18.717Z",
  },
  {
    index: 66,
    title: "The 25 best new productivity apps for 2019",
    url: "https://www.fastcompany.com/90326825/the-25-best-new-productivity-apps-for-2019",
    id: 321,
    parentId: "3",
    dateAddedLocal: "04/04/2019, 00:24:57",
    dateAddedUTC: "2019-04-03T18:54:57.657Z",
  },
  {
    index: 67,
    title: "Dashboard - BuyMeACoffee.com",
    url: "https://www.buymeacoffee.com/dashboard",
    id: 322,
    parentId: "3",
    dateAddedLocal: "07/04/2019, 19:22:53",
    dateAddedUTC: "2019-04-07T13:52:53.453Z",
  },
  {
    index: 68,
    title: "WebGL Fluid Simulation",
    url: "https://paveldogreat.github.io/WebGL-Fluid-Simulation/",
    id: 323,
    parentId: "3",
    dateAddedLocal: "23/07/2019, 21:58:33",
    dateAddedUTC: "2019-07-23T16:28:33.717Z",
  },
  {
    index: 69,
    title:
      "Works: Portfolio of Design Projects and Case Studies | Tubik Studio",
    url: "https://tubikstudio.com/works/",
    id: 324,
    parentId: "3",
    dateAddedLocal: "28/07/2019, 10:13:32",
    dateAddedUTC: "2019-07-28T04:43:32.202Z",
  },
  {
    index: 70,
    title: "gl particle sns icons.",
    url: "https://codepen.io/kenjiSpecial/pen/wavooR?editors=0010",
    id: 325,
    parentId: "3",
    dateAddedLocal: "14/08/2019, 19:05:03",
    dateAddedUTC: "2019-08-14T13:35:03.273Z",
  },
  {
    index: 71,
    title: "Instagram python bot",
    url: "https://www.producthunt.com/posts/instagram-open-source-hackers-community",
    id: 326,
    parentId: "3",
    dateAddedLocal: "28/08/2019, 22:21:03",
    dateAddedUTC: "2019-08-28T16:51:03.140Z",
  },
  {
    index: 72,
    title: "snipcode",
    id: 327,
    parentId: "3",
    dateAddedLocal: "03/11/2020, 11:49:57",
    dateAddedUTC: "2020-11-03T06:19:57.303Z",
  },
  {
    index: 0,
    title: "backend api",
    url: "https://medium.com/hackernoon/building-a-node-js-powered-api-with-express-mongoose-mongodb-19b14fd4b51e",
    id: 328,
    parentId: "327",
    dateAddedLocal: "29/08/2019, 18:20:37",
    dateAddedUTC: "2019-08-29T12:50:37.147Z",
  },
  {
    index: 1,
    title: "The Winds 2.0 Stack",
    url: "https://medium.com/hackernoon/the-winds-2-0-stack-59e593ff9f07",
    id: 329,
    parentId: "327",
    dateAddedLocal: "29/08/2019, 18:23:30",
    dateAddedUTC: "2019-08-29T12:53:30.573Z",
  },
  {
    index: 2,
    title: "",
    url: "https://medium.com/hackernoon/winds-2-1-building-touch-bar-support-for-macos-in-electron-with-react-e10adb811c91?source=---------33------------------",
    id: 330,
    parentId: "327",
    dateAddedLocal: "29/08/2019, 18:23:53",
    dateAddedUTC: "2019-08-29T12:53:53.877Z",
  },
  {
    index: 3,
    title: "touchbar support :P",
    url: "https://medium.com/hackernoon/winds-2-1-building-touch-bar-support-for-macos-in-electron-with-react-e10adb811c91",
    id: 331,
    parentId: "327",
    dateAddedLocal: "29/08/2019, 18:23:58",
    dateAddedUTC: "2019-08-29T12:53:58.317Z",
  },
  {
    index: 4,
    title: "Deploying  ",
    url: "https://medium.com/hackernoon/deploying-the-winds-api-to-aws-ecs-with-docker-compose-4daf8d130d3b",
    id: 332,
    parentId: "327",
    dateAddedLocal: "29/08/2019, 18:25:01",
    dateAddedUTC: "2019-08-29T12:55:01.230Z",
  },
  {
    index: 5,
    title: "Tempo - The email client for Mac that helps you focus",
    url: "https://www.yourtempo.co/?ref=producthunt",
    id: 333,
    parentId: "327",
    dateAddedLocal: "03/09/2019, 11:04:04",
    dateAddedUTC: "2019-09-03T05:34:04.404Z",
  },
  {
    index: 6,
    title: "Inyo Personal Assistant for freelancers",
    url: "https://inyo.me/home/?ref=producthunt#",
    id: 334,
    parentId: "327",
    dateAddedLocal: "12/09/2019, 12:39:57",
    dateAddedUTC: "2019-09-12T07:09:57.211Z",
  },
  {
    index: 73,
    title: "mac win",
    id: 335,
    parentId: "3",
    dateAddedLocal: "03/11/2020, 11:49:57",
    dateAddedUTC: "2020-11-03T06:19:57.304Z",
  },
  {
    index: 0,
    title: "mac p1",
    url: "https://www.youtube.com/watch?v=CbgoXio7cD8",
    id: 336,
    parentId: "335",
    dateAddedLocal: "11/09/2019, 23:00:04",
    dateAddedUTC: "2019-09-11T17:30:04.500Z",
  },
  {
    index: 1,
    title:
      "(22) Detailed Step by Step Guide to install macOs Sierra on Any Dell Laptop - YouTube",
    url: "https://www.youtube.com/watch?v=izzZ53MY0r4",
    id: 337,
    parentId: "335",
    dateAddedLocal: "11/09/2019, 23:00:27",
    dateAddedUTC: "2019-09-11T17:30:27.139Z",
  },
  {
    index: 74,
    title: "Software versioning - Wikipedia",
    url: "https://en.m.wikipedia.org/wiki/Software_versioning",
    id: 338,
    parentId: "3",
    dateAddedLocal: "16/09/2019, 07:55:25",
    dateAddedUTC: "2019-09-16T02:25:25.787Z",
  },
  {
    index: 75,
    title:
      'A thread written by @QuinnyPig: "For every retweet this gets, I will add an Uncomfortable @awscloud Truth to the [...]"',
    url: "https://threader.app/thread/1173367909369802752",
    id: 339,
    parentId: "3",
    dateAddedLocal: "17/09/2019, 11:48:33",
    dateAddedUTC: "2019-09-17T06:18:33.061Z",
  },
  {
    index: 76,
    title:
      'The Making of "The Aviator": Animating a Basic 3D Scene with Three.js | Codrops',
    url: "https://tympanus.net/codrops/2016/04/26/the-aviator-animating-basic-3d-scene-threejs/",
    id: 340,
    parentId: "3",
    dateAddedLocal: "04/10/2019, 11:46:42",
    dateAddedUTC: "2019-10-04T06:16:42.129Z",
  },
  {
    index: 77,
    title:
      "Extension Workshop | Firefox Extension Workshop. Make the web do what you want. If you can dream it, our open souce API and your HTML, CSS, and JavaScript skills can make it happen.",
    url: "https://extensionworkshop.com/",
    id: 341,
    parentId: "3",
    dateAddedLocal: "06/10/2019, 19:46:28",
    dateAddedUTC: "2019-10-06T14:16:28.185Z",
  },
  {
    index: 78,
    title: "100 example UX problems - UX Collective",
    url: "https://uxdesign.cc/100-example-ux-problems-f90e7f61dd9f",
    id: 342,
    parentId: "3",
    dateAddedLocal: "12/10/2019, 17:01:46",
    dateAddedUTC: "2019-10-12T11:31:46.254Z",
  },
  {
    index: 79,
    title: "Watch Ghostbusters Movie Free Online - SolarMovie",
    url: "https://solarmovies.yt/watch/ghostbusters-7794/?ep=32710",
    id: 343,
    parentId: "3",
    dateAddedLocal: "16/11/2019, 02:12:50",
    dateAddedUTC: "2019-11-15T20:42:50.077Z",
  },
  {
    index: 80,
    title:
      "Comprehensive Ranking System (CRS) tool: skilled immigrants (Express Entry)",
    url: "https://www.cic.gc.ca/english/immigrate/skilled/crs-tool.asp",
    id: 344,
    parentId: "3",
    dateAddedLocal: "29/03/2020, 00:26:08",
    dateAddedUTC: "2020-03-28T18:56:08.031Z",
  },
  {
    index: 81,
    title:
      "Create Chrome Extension in React - DEV Community ðŸ‘©\u200dðŸ’»ðŸ‘¨\u200dðŸ’»",
    url: "https://dev.to/bayardlouis470/create-chrome-extension-in-react-3pna",
    id: 345,
    parentId: "3",
    dateAddedLocal: "29/03/2020, 23:23:26",
    dateAddedUTC: "2020-03-29T17:53:26.088Z",
  },
  {
    index: 82,
    title: "ShareDrop",
    url: "https://www.sharedrop.io/",
    id: 346,
    parentId: "3",
    dateAddedLocal: "19/04/2020, 00:12:35",
    dateAddedUTC: "2020-04-18T18:42:35.560Z",
  },
  {
    index: 83,
    title:
      "Building a Personal Site with Gatsby Part 3: Generating Blog Posts with Markdown Files | Denny Tek",
    url: "https://dennytek.com/blog/personal-site-with-gatsby-part-3",
    id: 347,
    parentId: "3",
    dateAddedLocal: "07/05/2020, 22:21:32",
    dateAddedUTC: "2020-05-07T16:51:32.378Z",
  },
  {
    index: 84,
    title: "diary",
    id: 348,
    parentId: "3",
    dateAddedLocal: "03/11/2020, 11:49:57",
    dateAddedUTC: "2020-11-03T06:19:57.305Z",
  },
  {
    index: 0,
    title: "12f327a3dcd7b276944b07e0b9ea2e5b.png (1600Ã—1200)",
    url: "https://cdn.dribbble.com/users/653463/screenshots/8355558/media/12f327a3dcd7b276944b07e0b9ea2e5b.png",
    id: 349,
    parentId: "348",
    dateAddedLocal: "10/05/2020, 14:06:07",
    dateAddedUTC: "2020-05-10T08:36:07.605Z",
  },
  {
    index: 1,
    title:
      "illustration-progress@2x-0b1c3f451ee4a879968130db954e4ede.png (1024Ã—666)",
    url: "https://img.imageboss.me/tangerine/width/1024/format:webp/static/illustration-progress@2x-0b1c3f451ee4a879968130db954e4ede.png",
    id: 350,
    parentId: "348",
    dateAddedLocal: "10/05/2020, 14:06:25",
    dateAddedUTC: "2020-05-10T08:36:25.661Z",
  },
  {
    index: 2,
    title:
      "illustration-mood@2x-d2932f9df2320bc943248fdc1ddc8bee.png (1024Ã—703)",
    url: "https://img.imageboss.me/tangerine/width/1024/format:webp/static/illustration-mood@2x-d2932f9df2320bc943248fdc1ddc8bee.png",
    id: 351,
    parentId: "348",
    dateAddedLocal: "10/05/2020, 14:06:48",
    dateAddedUTC: "2020-05-10T08:36:48.245Z",
  },
  {
    index: 3,
    title:
      "illustration-history@2x-864241866db2f9048950f1e5887b1dca.png (1024Ã—835)",
    url: "https://img.imageboss.me/tangerine/width/1024/format:webp/static/illustration-history@2x-864241866db2f9048950f1e5887b1dca.png",
    id: 352,
    parentId: "348",
    dateAddedLocal: "10/05/2020, 14:07:05",
    dateAddedUTC: "2020-05-10T08:37:05.599Z",
  },
  {
    index: 4,
    title:
      "Tangerine - A simple and beautiful habit and mood tracking app | Product Hunt",
    url: "https://www.producthunt.com/posts/tangerine-2?utm_source=badge-featured&utm_medium=badge&utm_souce=badge-tangerine-2",
    id: 353,
    parentId: "348",
    dateAddedLocal: "10/05/2020, 14:09:10",
    dateAddedUTC: "2020-05-10T08:39:10.723Z",
  },
  {
    index: 5,
    title: "Joyster App",
    url: "https://joysterapp.com/",
    id: 354,
    parentId: "348",
    dateAddedLocal: "10/05/2020, 14:09:18",
    dateAddedUTC: "2020-05-10T08:39:18.082Z",
  },
  {
    index: 6,
    title: "Tangerine | Habit and mood tracking app",
    url: "https://tangerine.app/",
    id: 355,
    parentId: "348",
    dateAddedLocal: "10/05/2020, 14:09:24",
    dateAddedUTC: "2020-05-10T08:39:24.138Z",
  },
  {
    index: 7,
    title:
      "Build a React Calendar Component from scratch - Programming with Mosh",
    url: "https://programmingwithmosh.com/react/build-a-react-calendar-component-from-scratch/",
    id: 356,
    parentId: "348",
    dateAddedLocal: "21/05/2020, 17:49:20",
    dateAddedUTC: "2020-05-21T12:19:20.548Z",
  },
  {
    index: 8,
    title:
      "Sync your React Native SQLite database between devices with Dropbox â€“ Bruce Lefebvre",
    url: "https://brucelefebvre.com/blog/2018/12/05/sync-react-native-sqlite-db-with-dropbox/",
    id: 357,
    parentId: "348",
    dateAddedLocal: "01/06/2020, 21:52:27",
    dateAddedUTC: "2020-06-01T16:22:27.607Z",
  },
  {
    index: 9,
    title: "Habit Tracker App on Behance",
    url: "https://www.behance.net/gallery/97038337/Habit-Tracker-App?tracking_source=search_projects_recommended%7Chabit%20app",
    id: 358,
    parentId: "348",
    dateAddedLocal: "01/06/2020, 22:15:43",
    dateAddedUTC: "2020-06-01T16:45:43.969Z",
  },
  {
    index: 10,
    title: "Add a splash screen to a React Native app - Appstud - Medium",
    url: "https://medium.com/@appstud/add-a-splash-screen-to-a-react-native-app-810492e773f9",
    id: 359,
    parentId: "348",
    dateAddedLocal: "09/06/2020, 18:03:01",
    dateAddedUTC: "2020-06-09T12:33:01.037Z",
  },
  {
    index: 11,
    title: "How to show Ads in React Native? - DEV",
    url: "https://dev.to/srajesh636/how-to-show-ads-in-react-native-lcj",
    id: 360,
    parentId: "348",
    dateAddedLocal: "10/06/2020, 14:15:20",
    dateAddedUTC: "2020-06-10T08:45:20.479Z",
  },
  {
    index: 12,
    title: "dribbble-inpursuit.png (1600Ã—1200)",
    url: "https://cdn.dribbble.com/users/29543/screenshots/6575071/dribbble-inpursuit.png",
    id: 361,
    parentId: "348",
    dateAddedLocal: "10/06/2020, 17:18:15",
    dateAddedUTC: "2020-06-10T11:48:15.685Z",
  },
  {
    index: 13,
    title:
      "https://cdn.dribbble.com/users/1960305/screenshots/10687809/media/8a1622366a4d444737dd1e390ce2b88a.mp4",
    url: "https://cdn.dribbble.com/users/1960305/screenshots/10687809/media/8a1622366a4d444737dd1e390ce2b88a.mp4",
    id: 362,
    parentId: "348",
    dateAddedLocal: "10/06/2020, 19:17:00",
    dateAddedUTC: "2020-06-10T13:47:00.660Z",
  },
  {
    index: 14,
    title:
      "Things Pull-to-search - â€œCan it be done in React Native?â€ - YouTube",
    url: "https://www.youtube.com/watch?v=VZ73JdhjFC8",
    id: 363,
    parentId: "348",
    dateAddedLocal: "11/06/2020, 10:25:08",
    dateAddedUTC: "2020-06-11T04:55:08.585Z",
  },
  {
    index: 15,
    title:
      "react-ui-kit/dribbble2react: Transform Dribbble designs to React-Native code | Shop UI Kit >>",
    url: "https://github.com/react-ui-kit/dribbble2react",
    id: 364,
    parentId: "348",
    dateAddedLocal: "18/06/2020, 15:23:23",
    dateAddedUTC: "2020-06-18T09:53:23.351Z",
  },
  {
    index: 16,
    title:
      "fireship-io/223-electron-screen-recorder: Episode 223 - Build a Screen Recorder with Electron",
    url: "https://github.com/fireship-io/223-electron-screen-recorder",
    id: 365,
    parentId: "348",
    dateAddedLocal: "29/06/2020, 22:55:25",
    dateAddedUTC: "2020-06-29T17:25:25.683Z",
  },
  {
    index: 17,
    title: "Kairn (2020) â€¢ eFounders",
    url: "https://www.efounders.com/companies/kairn",
    id: 366,
    parentId: "348",
    dateAddedLocal: "06/07/2020, 14:36:03",
    dateAddedUTC: "2020-07-06T09:06:03.807Z",
  },
  {
    index: 18,
    title:
      "mansern/offline-first-demo: ReactJS offline-first fully working demo application",
    url: "https://github.com/mansern/offline-first-demo",
    id: 367,
    parentId: "348",
    dateAddedLocal: "19/07/2020, 13:26:39",
    dateAddedUTC: "2020-07-19T07:56:39.010Z",
  },
  {
    index: 85,
    title: "About Us - Grant Thornton International Ltd.",
    url: "https://www.grantthornton.global/en/about/",
    id: 373,
    parentId: "3",
    dateAddedLocal: "16/11/2020, 23:10:39",
    dateAddedUTC: "2020-11-16T17:40:39.676Z",
  },
  {
    index: 86,
    title:
      "Master (2021) HDRip Telugu (Original Version) Full Movie Watch Online Free | Movierulz",
    url: "https://4movierulz.mn/master-2021-hdrip-telugu-original-version-full-movie-watch-online-free/",
    id: 424,
    parentId: "3",
    dateAddedLocal: "20/02/2021, 12:57:25",
    dateAddedUTC: "2021-02-20T07:27:25.548Z",
  },
  {
    index: 87,
    title: "dribbble-sketch-palette",
    url: "https://github.com/amiechen/dribbble-sketch-palette/tree/master/Chrome",
    id: 426,
    parentId: "3",
    dateAddedLocal: "24/02/2021, 20:12:18",
    dateAddedUTC: "2021-02-24T14:42:18.641Z",
  },
];
